Sheet: iati_activity
A1: iati-identifier | B1: attributeVersion | C1: reporting-org | D1: reporting-org_1 | E1: reporting-org_2 | F1: titles | G1: descriptions_1 | H1: descriptions | I1: activity_status | J1: activity_date_1 | K1: activity_date_2 | L1: activity_date_3
A2: GB-COH-06368740-START-PROGRAM-2024 | B2: version = 2.03 | C2: GB-COH-06368740 | D2: 22 | E2: Start Network | F2: Start_ Network _Program | G2: 1 | H2: Description of Policy Objective: Start Network will tackle Policy Objective 3: | I2: 2 | J2: 2024-01-01 | K2: 2027-12-31

Sheet: Total_Budget_year
B1: Budgets_year
C2: 2024 | D2: 2025 | E2: 2026 | F2: 2027 | G2: Total
B3: I. Direct staff costs
A4: IA | B4: A. Staff costs | C4: of:=[$Total_Budget_outcome_year.E4] -> 181910.014929616 | D4: of:=[$Total_Budget_outcome_year.F4] -> 281825.061847227 | E4: of:=[$Total_Budget_outcome_year.G4] -> 283897.068931909 | F4: of:=[$Total_Budget_outcome_year.H4] -> 292624.453070662 | G4: of:=SUM([.C4:.F4]) -> 1040256.59877941
A5: IB | B5: B. Local staff costs | C5: of:=[$Total_Budget_outcome_year.E5] -> 100456.094189972 | D5: of:=[$Total_Budget_outcome_year.F5] -> 109146.760627105 | E5: of:=[$Total_Budget_outcome_year.G5] -> 98340.2029632108 | F5: of:=[$Total_Budget_outcome_year.H5] -> 101168.999721997 | G5: of:=SUM([.C5:.F5]) -> 409112.057502285
A6: IC | B6: C. Consultants and advisers | C6: of:=[$Total_Budget_outcome_year.E6]+[$Total_Budget_outcome_year.E7] -> 0 | D6: of:=[$Total_Budget_outcome_year.F6]+[$Total_Budget_outcome_year.F7] -> 42735.0429827 | E6: of:=[$Total_Budget_outcome_year.G6]+[$Total_Budget_outcome_year.G7] -> 42735.0429827 | F6: of:=[$Total_Budget_outcome_year.H6]+[$Total_Budget_outcome_year.H7] -> 85470.0859654 | G6: of:=SUM([.C6:.F6]) -> 170940.1719308
A7: I | B7: Subtotal I | C7: of:=SUM([.C4:.C6]) -> 282366.109119588 | D7: of:=SUM([.D4:.D6]) -> 433706.865457033 | E7: of:=SUM([.E4:.E6]) -> 424972.314877819 | F7: of:=SUM([.F4:.F6]) -> 479263.538758059 | G7: of:=SUM([.G4:.G6]) -> 1620308.8282125
B9: II. Other direct programme costs
A10: IIA | B10: A. Activity costs | C10: of:=[$Total_Budget_outcome_year.E11] -> 1283124.17991489 | D10: of:=[$Total_Budget_outcome_year.F11] -> 2298283.45973911 | E10: of:=[$Total_Budget_outcome_year.G11] -> 2237396.40267925 | F10: of:=[$Total_Budget_outcome_year.H11] -> 2440058.42957196 | G10: of:=SUM([.C10:.F10]) -> 8258862.47190521
A11: IIB | B11: B. Costs of granting local NGOs | C11: of:=[$Total_Budget_outcome_year.E30] -> 1018904.3438616 | D11: of:=[$Total_Budget_outcome_year.F30] -> 1447987.43070312 | E11: of:=[$Total_Budget_outcome_year.G30] -> 1637772.49000278 | F11: of:=[$Total_Budget_outcome_year.H30] -> 1812115.1087751 | G11: of:=SUM([.C11:.F11]) -> 5916779.3733426
A12: IIC | B12: C. Activity-related travel costs | C12: of:=[$Total_Budget_outcome_year.E31] -> 47222.23 | D12: of:=[$Total_Budget_outcome_year.F31] -> 97914.536877232 | E12: of:=[$Total_Budget_outcome_year.G31] -> 76799.146877232 | F12: of:=[$Total_Budget_outcome_year.H31] -> 73269.216877232 | G12: of:=SUM([.C12:.F12]) -> 295205.130631696
A13: IID | B13: D. Project office costs | C13: of:=[$Total_Budget_outcome_year.E32] -> 80512.8208055514 | D13: of:=[$Total_Budget_outcome_year.F32] -> 106616.718723371 | E13: of:=[$Total_Budget_outcome_year.G32] -> 95555.55587751 | F13: of:=[$Total_Budget_outcome_year.H32] -> 107948.71587751 | G13: of:=SUM([.C13:.F13]) -> 390633.811283942
A14: IIE | B14: E. Equipment and investments | C14: of:=[$Total_Budget_outcome_year.E33] -> 10000 | D14: of:=[$Total_Budget_outcome_year.F33] -> 50512.82 | E14: of:=[$Total_Budget_outcome_year.G33] -> 50512.82 | F14: of:=[$Total_Budget_outcome_year.H33] -> 50512.82 | G14: of:=SUM([.C14:.F14]) -> 161538.46
A15: IIF | B15: F. Monitoring, evaluation and learning | C15: of:=[$Total_Budget_outcome_year.E34] -> 0 | D15: of:=[$Total_Budget_outcome_year.F34] -> 31914.53008789 | E15: of:=[$Total_Budget_outcome_year.G34] -> 14000 | F15: of:=[$Total_Budget_outcome_year.H34] -> 54170.94008789 | G15: of:=SUM([.C15:.F15]) -> 100085.47017578
A16: IIG | B16: G. Auditing | C16: of:=[$Total_Budget_outcome_year.E35] -> 7000 | D16: of:=[$Total_Budget_outcome_year.F35] -> 7000 | E16: of:=[$Total_Budget_outcome_year.G35] -> 7000 | F16: of:=[$Total_Budget_outcome_year.H35] -> 7000 | G16: of:=SUM([.C16:.F16]) -> 28000
A17: II | B17: Subtotal II | C17: of:=[.C10]+SUM([.C12:.C16]) -> 1427859.23072044 | D17: of:=[.D10]+SUM([.D12:.D16]) -> 2592242.0654276 | E17: of:=[.E10]+SUM([.E12:.E16]) -> 2481263.925434 | F17: of:=[.F10]+SUM([.F12:.F16]) -> 2732960.12241459 | G17: of:=[.G10]+SUM([.G12:.G16]) -> 9234325.34399663
B18: Total of I and II | C18: of:=[.C17]+[.C7] -> 1710225.33984003 | D18: of:=[.D17]+[.D7] -> 3025948.93088463 | E18: of:=[.E17]+[.E7] -> 2906236.24031182 | F18: of:=[.F17]+[.F7] -> 3212223.66117265 | G18: of:=[.G7]+[.G17] -> 10854634.1722091
B20: III. Overheads / indirect costs
A21: IIIA | B21: A. ICR (max. 15% of IV) | C21: of:=[$Total_Budget_outcome_year.E42] -> 249400.458524358 | D21: of:=[$Total_Budget_outcome_year.F42] -> 407111.801149929 | E21: of:=[$Total_Budget_outcome_year.G42] -> 418928.254180936 | F21: of:=[$Total_Budget_outcome_year.H42] -> 463901.383935643 | G21: of:=SUM([.C21:.F21]) -> 1539341.89779087
A22: III | B22: Total of III | C22: of:=[.C21] -> 249400.458524358 | D22: of:=[.D21] -> 407111.801149929 | E22: of:=[.E21] -> 418928.254180936 | F22: of:=[.F21] -> 463901.383935643 | G22: of:=SUM([.G19:.G21]) -> 1539341.89779087
A23: IV | B23: Total of I, II and III | C23: of:=[.C22]+[.C17]+[.C7] -> 1959625.79836439 | D23: of:=[.D22]+[.D17]+[.D7] -> 3433060.73203456 | E23: of:=[.E22]+[.E17]+[.E7] -> 3325164.49449275 | F23: of:=[.F22]+[.F17]+[.F7] -> 3676125.04510829 | G23: of:=[.G22]+[.G17]+[.G7] -> 12393976.07
A24: V | B24: Contingencies (max. 4% of IV) | C24: 0 | D24: 0 | E24: 0 | F24: 0 | G24: of:=SUM([.C24:.F24]) -> 0
B25: TOTAL | C25: of:=[.C23]+[.C24] -> 1959625.79836439 | D25: of:=[.D23]+[.D24] -> 3433060.73203456 | E25: of:=[.E23]+[.E24] -> 3325164.49449275 | F25: of:=[.F23]+[.F24] -> 3676125.04510829 | G25: of:=SUM([.C25:.F25]) -> 12393976.07
B26: ICR check | C26: of:=[.C22]/[.C23] -> 0.127269430078192 | D26: of:=[.D22]/[.D23] -> 0.118585668278772 | E26: of:=[.E22]/[.E23] -> 0.125987227060429 | F26: of:=[.F22]/[.F23] -> 0.126193037027656
B27: Average ICR | C27: of:=AVERAGE([.C26:.F26]) -> 0.124508840611262

Sheet: Total_Budget_outcome_year
B1: iati-identifier | C1: Budgets_outcomes
E2: 2024 | F2: 2025 | G2: 2026 | H2: 2027 | I2: Total
B3: GB-COH-06368740-START-PROGRAM-2024 | C3: I. Direct staff costs
A4: IA | C4: A. Staff costs | E4: of:=[$Annual_Budget_country_2024.K4] -> 181910.014929616 | F4: of:=[$Annual_Budget_country_2025.K4] -> 281825.061847227 | G4: of:=[$Annual_Budget_country_2026.K4] -> 283897.068931909 | H4: of:=[$Annual_Budget_country_2027.K4] -> 292624.453070662 | I4: of:=SUM([.E4:.H4]) -> 1040256.59877941
A5: IB | C5: B. Local staff costs | E5: of:=[$Annual_Budget_country_2024.K5] -> 100456.094189972 | F5: of:=[$Annual_Budget_country_2025.K5] -> 109146.760627105 | G5: of:=[$Annual_Budget_country_2026.K5] -> 98340.2029632108 | H5: of:=[$Annual_Budget_country_2027.K5] -> 101168.999721997 | I5: of:=SUM([.E5:.H5]) -> 409112.057502285
A6: IC | C6: C. Consultants and advisers | E6: of:=[$Annual_Budget_country_2024.K6] -> 0 | F6: of:=[$Annual_Budget_country_2025.K6] -> 42735.0429827 | G6: of:=[$Annual_Budget_country_2026.K6] -> 42735.0429827 | H6: of:=[$Annual_Budget_country_2027.K6] -> 85470.0859654 | I6: of:=SUM([.E6:.H6]) -> 170940.1719308
A7: ID | C7: D. Local consultants and advisers | E7: of:=[$Annual_Budget_country_2024.K7] -> 0 | F7: of:=[$Annual_Budget_country_2025.K7] -> 0 | G7: of:=[$Annual_Budget_country_2026.K7] -> 0 | H7: of:=[$Annual_Budget_country_2027.K7] -> 0 | I7: of:=SUM([.E7:.H7]) -> 0
A8: I | C8: Subtotal I | E8: of:=SUM([.E4:.E7]) -> 282366.109119588 | F8: of:=SUM([.F4:.F7]) -> 433706.865457033 | G8: of:=SUM([.G4:.G7]) -> 424972.314877819 | H8: of:=SUM([.H4:.H7]) -> 479263.538758059 | I8: of:=SUM([.E8:.H8]) -> 1620308.8282125
C10: II. Other direct programme costs
A11: IIA | C11: A. Activity costs | E11: of:=[$Annual_Budget_country_2024.K11] -> 1283124.17991489 | F11: of:=[$Annual_Budget_country_2025.K11] -> 2298283.45973911 | G11: of:=[$Annual_Budget_country_2026.K11] -> 2237396.40267925 | H11: of:=[$Annual_Budget_country_2027.K11] -> 2440058.42957196 | I11: of:=SUM([.E11:.H11]) -> 8258862.47190521
C12: Outcome 1 | D12: of:=[$Logframe.B2] -> Expand network of humanitarian hubs | E12: of:=[$Annual_Budget_country_2024.K12] -> 226495.72780831 | F12: of:=[$Annual_Budget_country_2025.K12] -> 262931.61929966 | G12: of:=[$Annual_Budget_country_2026.K12] -> 354811.971712465 | H12: of:=[$Annual_Budget_country_2027.K12] -> 312076.928729765 | I12: of:=SUM([.E12:.H12]) -> 1156316.2475502
C13: Output 1.1 | D13: of:=[$Logframe.B3] -> Hubs: # mature (% of total) | E13: of:=[$Annual_Budget_country_2024.K13] -> 72649.57307059 | F13: of:=[$Annual_Budget_country_2025.K13] -> 63829.06017578 | G13: of:=[$Annual_Budget_country_2026.K13] -> 115111.11175502 | H13: of:=[$Annual_Budget_country_2027.K13] -> 132205.1289481 | I13: of:=SUM([.E13:.H13]) -> 383794.87394949
C14: Output 1.2 | D14: of:=[$Logframe.B4] -> Total number of hubs  | E14: of:=[$Annual_Budget_country_2024.K14] -> 153846.15473772 | F14: of:=[$Annual_Budget_country_2025.K14] -> 199102.55912388 | G14: of:=[$Annual_Budget_country_2026.K14] -> 239700.859957445 | H14: of:=[$Annual_Budget_country_2027.K14] -> 179871.799781665 | I14: of:=SUM([.E14:.H14]) -> 772521.37360071
C15: Outcome 2 | D15: of:=[$Logframe.B6] -> Scope, test and operationalise locally-led/designed tools and approaches to the anticipation of the humanitarian impact of conflict and man-made risks. | E15: of:=[$Annual_Budget_country_2024.K15] -> 0 | F15: of:=[$Annual_Budget_country_2025.K15] -> 123931.62464983 | G15: of:=[$Annual_Budget_country_2026.K15] -> 98290.5988602099 | H15: of:=[$Annual_Budget_country_2027.K15] -> 226495.72780831 | I15: of:=SUM([.E15:.H15]) -> 448717.95131835
C16: Output 2.1 | D16: of:=[$Logframe.B7] -> # of SF projects implemented as a result of forecasted hazard identified by tools
 | E16: of:=[$Annual_Budget_country_2024.K16] -> 0 | F16: of:=[$Annual_Budget_country_2025.K16] -> 25641.02578962 | G16: of:=[$Annual_Budget_country_2026.K16] -> 0 | H16: of:=[$Annual_Budget_country_2027.K16] -> 0 | I16: of:=SUM([.E16:.H16]) -> 25641.02578962
C17: Output 2.2 | D17: of:=[$Logframe.B9] -> # of country/context specific tools that are developed  | E17: of:=[$Annual_Budget_country_2024.K17] -> 0 | F17: of:=[$Annual_Budget_country_2025.K17] -> 85470.0859654 | G17: of:=[$Annual_Budget_country_2026.K17] -> 85470.0859654 | H17: of:=[$Annual_Budget_country_2027.K17] -> 213675.2149135 | I17: of:=SUM([.E17:.H17]) -> 384615.3868443
C18: Output 2.3 | D18: of:=[$Logframe.B10] -> # of trainings/workshops for members to scale up anticipatory action interventions to prevent the humanitarian effect of man-made crises | E18: of:=[$Annual_Budget_country_2024.K18] -> 0 | F18: of:=[$Annual_Budget_country_2025.K18] -> 12820.51289481 | G18: of:=[$Annual_Budget_country_2026.K18] -> 12820.51289481 | H18: of:=[$Annual_Budget_country_2027.K18] -> 12820.51289481 | I18: of:=SUM([.E18:.H18]) -> 38461.53868443
C19: Outcome 3 | D19: of:=[$Logframe.B11] -> (a) Upscale the involvement of national and local organisations in decision making and (b) Improve their access to international funding,and (c) share best practices related to the above with other pooled funds | E19: of:=[$Annual_Budget_country_2024.K19] -> 935141.23210658 | F19: of:=[$Annual_Budget_country_2025.K19] -> 1300450.12578962 | G19: of:=[$Annual_Budget_country_2026.K19] -> 1054558.79210658 | H19: of:=[$Annual_Budget_country_2027.K19] -> 1059281.05210658 | I19: of:=SUM([.E19:.H19]) -> 4349431.20210936
C20: Output 3.1 | D20: of:=[$Logframe.B13] -> % of funding to Local/National NGOs 
(disaggregated by: 
i) direct (global Start Fund)
ii) direct (Start Fund Bangladesh)
(iii) in countries where we have LNNGO presence (global SF) | E20: of:=[$Annual_Budget_country_2024.K20] -> 863188.2149135 | F20: of:=[$Annual_Budget_country_2025.K20] -> 1017044.19 | G20: of:=[$Annual_Budget_country_2026.K20] -> 854268.2149135 | H20: of:=[$Annual_Budget_country_2027.K20] -> 851768.2149135 | I20: of:=SUM([.E20:.H20]) -> 3586268.8347405
C21: Output 3.2 | D21: of:=[$Logframe.B16] -> # of trainings provided to LLNGOs on implementing key humanitarian principles and enhanced local leadership and governance | E21: of:=[$Annual_Budget_country_2024.K21] -> 4560 | F21: of:=[$Annual_Budget_country_2025.K21] -> 116500 | G21: of:=[$Annual_Budget_country_2026.K21] -> 20000 | H21: of:=[$Annual_Budget_country_2027.K21] -> 25170.94 | I21: of:=SUM([.E21:.H21]) -> 166230.94
C22: Output 3.3 | D22: of:=[$Logframe.B17] -> # of mentors across various countries trained to provide ongoing support and guidance to member organizations | E22: of:=[$Annual_Budget_country_2024.K22] -> 17094.01719308 | F22: of:=[$Annual_Budget_country_2025.K22] -> 41777.76578962 | G22: of:=[$Annual_Budget_country_2026.K22] -> 25162.40719308 | H22: of:=[$Annual_Budget_country_2027.K22] -> 25162.39719308 | I22: of:=SUM([.E22:.H22]) -> 109196.58736886
C23: Output 3.4 | D23: of:=[$Logframe.B18] -> # of evaluations/research pieces related to the impact of strengthening local leadership and localisation practices | E23: of:=[$Annual_Budget_country_2024.K23] -> 35299 | F23: of:=[$Annual_Budget_country_2025.K23] -> 95128.17 | G23: of:=[$Annual_Budget_country_2026.K23] -> 95128.17 | H23: of:=[$Annual_Budget_country_2027.K23] -> 97179.5 | I23: of:=SUM([.E23:.H23]) -> 322734.84
C24: Output 3.5 | D24: of:=[$Logframe.B19] -> # of Learning Grants awarded to LLNGOs | E24: of:=[$Annual_Budget_country_2024.E24] -> 15000 | F24: of:=[$Annual_Budget_country_2025.E24] -> 30000 | G24: of:=[$Annual_Budget_country_2026.E24] -> 60000 | H24: of:=[$Annual_Budget_country_2027.E24] -> 60000 | I24: of:=SUM([.E24:.H24]) -> 165000
C25: Outcome 4 | D25: of:=[$Logframe.B20] -> (a) Support BAU (business as usual) due diligence processes for local and national members, and b) support innovative approaches to due diligence, risk, and compliance through learning iterations and testing of initiatives to support local and national members (b) support innovation initiatives for hubs, and support local humanitarians to take the lead in identifying local solutions to local problems. | E25: of:=[$Annual_Budget_country_2024.K25] -> 121487.22 | F25: of:=[$Annual_Budget_country_2025.K25] -> 610970.09 | G25: of:=[$Annual_Budget_country_2026.K25] -> 729735.04 | H25: of:=[$Annual_Budget_country_2027.K25] -> 842204.720927304 | I25: of:=SUM([.E25:.H25]) -> 2304397.0709273
C26: Output 4.1 | D26: of:=[$Logframe.B21] -> a) # member local and national organisations that have progressed through due diligence
ai) # of organisations that participated in DD innovation pilot and feel better supported by our compliance systems 
b) # community-led innovation initiatives co-designed and run with hubs | E26: of:=[$Annual_Budget_country_2024.K26] -> 82320.52 | F26: of:=[$Annual_Budget_country_2025.K26] -> 455970.09 | G26: of:=[$Annual_Budget_country_2026.K26] -> 552735.04 | H26: of:=[$Annual_Budget_country_2027.K26] -> 647077.66 | I26: of:=SUM([.E26:.H26]) -> 1738103.31
C27: Output 4.2 | D27: of:=[$Logframe.B22] -> # of members involved in innovation initiatives (approaches, tools and services) across hubs | E27: of:=[$Annual_Budget_country_2024.K27] -> 12000 | F27: of:=[$Annual_Budget_country_2025.K27] -> 25000 | G27: of:=[$Annual_Budget_country_2026.K27] -> 32000 | H27: of:=[$Annual_Budget_country_2027.K27] -> 36175.8109273036 | I27: of:=SUM([.E27:.H27]) -> 105175.810927304
C28: Output 4.3 | D28: of:=[$Logframe.B23] -> # research pieces related to innovation and systems change  | E28: of:=[$Annual_Budget_country_2024.K28] -> 27166.7 | F28: of:=[$Annual_Budget_country_2025.K28] -> 80000 | G28: of:=[$Annual_Budget_country_2026.K28] -> 80000 | H28: of:=[$Annual_Budget_country_2027.K28] -> 82327.32 | I28: of:=SUM([.E28:.H28]) -> 269494.02
C29: Output 4.4 | D29: of:=[$Logframe.B24] -> £ - Amount of programme funding granted to LNNGOs for innovation projects and initiatives  | E29: of:=[$Annual_Budget_country_2024.K29] -> 0 | F29: of:=[$Annual_Budget_country_2025.K29] -> 50000 | G29: of:=[$Annual_Budget_country_2026.K29] -> 65000 | H29: of:=[$Annual_Budget_country_2027.K29] -> 76623.93 | I29: of:=SUM([.E29:.H29]) -> 191623.93
A30: IIB | C30: B. Costs of granting local NGOs | E30: of:=[$Annual_Budget_country_2024.K30] -> 1018904.3438616 | F30: of:=[$Annual_Budget_country_2025.K30] -> 1447987.43070312 | G30: of:=[$Annual_Budget_country_2026.K30] -> 1637772.49000278 | H30: of:=[$Annual_Budget_country_2027.K30] -> 1812115.1087751 | I30: of:=SUM([.E30:.H30]) -> 5916779.3733426
A31: IIC | C31: C. Activity-related travel costs | E31: of:=[$Annual_Budget_country_2024.K31] -> 47222.23 | F31: of:=[$Annual_Budget_country_2025.K31] -> 97914.536877232 | G31: of:=[$Annual_Budget_country_2026.K31] -> 76799.146877232 | H31: of:=[$Annual_Budget_country_2027.K31] -> 73269.216877232 | I31: of:=SUM([.E31:.H31]) -> 295205.130631696
A32: IID | C32: D. Project office costs | E32: of:=[$Annual_Budget_country_2024.K32] -> 80512.8208055514 | F32: of:=[$Annual_Budget_country_2025.K32] -> 106616.718723371 | G32: of:=[$Annual_Budget_country_2026.K32] -> 95555.55587751 | H32: of:=[$Annual_Budget_country_2027.K32] -> 107948.71587751 | I32: of:=SUM([.E32:.H32]) -> 390633.811283942
A33: IIE | C33: E. Equipment and investments | E33: of:=[$Annual_Budget_country_2024.K33] -> 10000 | F33: of:=[$Annual_Budget_country_2025.K33] -> 50512.82 | G33: of:=[$Annual_Budget_country_2026.K33] -> 50512.82 | H33: of:=[$Annual_Budget_country_2027.K33] -> 50512.82 | I33: of:=SUM([.E33:.H33]) -> 161538.46
A34: IIF | C34: F. Monitoring, evaluation and learning | E34: of:=[$Annual_Budget_country_2024.K34] -> 0 | F34: of:=[$Annual_Budget_country_2025.K34] -> 31914.53008789 | G34: of:=[$Annual_Budget_country_2026.K34] -> 14000 | H34: of:=[$Annual_Budget_country_2027.K34] -> 54170.94008789 | I34: of:=SUM([.E34:.H34]) -> 100085.47017578
A35: IIG | C35: G. Auditing | E35: of:=[$Annual_Budget_country_2024.K35] -> 7000 | F35: of:=[$Annual_Budget_country_2025.K35] -> 7000 | G35: of:=[$Annual_Budget_country_2026.K35] -> 7000 | H35: of:=[$Annual_Budget_country_2027.K35] -> 7000 | I35: of:=SUM([.E35:.H35]) -> 28000
A36: II | C36: Subtotal II | E36: of:=[.E11]+SUM([.E31:.E35]) -> 1427859.23072044 | F36: of:=[.F11]+SUM([.F31:.F35]) -> 2592242.0654276 | G36: of:=[.G11]+SUM([.G31:.G35]) -> 2481263.925434 | H36: of:=[.H11]+SUM([.H31:.H35]) -> 2732960.12241459 | I36: of:=SUM([.E36:.H36]) -> 9234325.34399663
C37: Total of I and II | E37: of:=[.E36]+[.E8] -> 1710225.33984003 | F37: of:=[.F36]+[.F8] -> 3025948.93088463 | G37: of:=[.G36]+[.G8] -> 2906236.24031182 | H37: of:=[.H36]+[.H8] -> 3212223.66117265 | I37: of:=[.I36]+[.I8] -> 10854634.1722091
C39: III. Overheads / indirect costs
A40: IIIA | C40: A. ICR lead party | E40: of:=[$Annual_Budget_country_2024.K40] -> 153920.280585603 | F40: of:=[$Annual_Budget_country_2025.K40] -> 272335.403779617 | G40: of:=[$Annual_Budget_country_2026.K40] -> 261561.261628063 | H40: of:=[$Annual_Budget_country_2027.K40] -> 289100.129505538 | I40: of:=SUM([.E40:.H40]) -> 976917.075498822
A41: IIIB | C41: B. ICR local partners | E41: of:=[$Annual_Budget_country_2024.K41] -> 95480.177938755 | F41: of:=[$Annual_Budget_country_2025.K41] -> 134776.397370312 | G41: of:=[$Annual_Budget_country_2026.K41] -> 157366.992552873 | H41: of:=[$Annual_Budget_country_2027.K41] -> 174801.254430105 | I41: of:=SUM([.E41:.H41]) -> 562424.822292045
A42: III | C42: Total of III | E42: of:=SUM([.E40:.E41]) -> 249400.458524358 | F42: of:=SUM([.F40:.F41]) -> 407111.801149929 | G42: of:=SUM([.G40:.G41]) -> 418928.254180936 | H42: of:=SUM([.H40:.H41]) -> 463901.383935643 | I42: of:=SUM([.I40:.I41]) -> 1539341.89779087
A43: IV | C43: Total of I, II and III | E43: of:=[.E37]+[.E42] -> 1959625.79836439 | F43: of:=[.F37]+[.F42] -> 3433060.73203456 | G43: of:=[.G37]+[.G42] -> 3325164.49449275 | H43: of:=[.H37]+[.H42] -> 3676125.04510829 | I43: of:=[.I42]+[.I36]+[.I8] -> 12393976.07
A44: V | C44: Contingencies (max. 4% of IV) | E44: 0 | F44: 0 | G44: 0 | H44: 0 | I44: of:=SUM([.E44:.H44]) -> 0
C45: TOTAL | E45: of:=[.E43]+[.E44] -> 1959625.79836439 | F45: of:=[.F43]+[.F44] -> 3433060.73203456 | G45: of:=[.G43]+[.G44] -> 3325164.49449275 | H45: of:=[.H43]+[.H44] -> 3676125.04510829 | I45: of:=SUM([.E45:.H45]) -> 12393976.07
D46: ICR check | E46: of:=[.E42]/[.E43] -> 0.127269430078192 | F46: of:=[.F42]/[.F43] -> 0.118585668278772 | G46: of:=[.G42]/[.G43] -> 0.125987227060429 | H46: of:=[.H42]/[.H43] -> 0.126193037027656
D47: Average ICR | E47: of:=AVERAGE([.E46:.H46]) -> 0.124508840611262

Sheet: Annual_Budget_country_2024
B1: iati-identifier | C1: Budgets_country_2024
E2: Global | F2: Country 2 | G2: Country 3 | H2: Country 4 | I2: Country 5 | J2: Country 6 | K2: Total
B3: GB-COH-06368740-START-PROGRAM-2024 | C3: I. Direct staff costs
A4: IA | C4: A. Staff costs | E4: 181910.014929616 | F4: 0 | G4: 0 | H4: 0 | I4: 0 | J4: 0 | K4: of:=SUM([.E4:.J4]) -> 181910.014929616
A5: IB | C5: B. Local staff costs | E5: 100456.094189972 | F5: 0 | G5: 0 | H5: 0 | I5: 0 | J5: 0 | K5: of:=SUM([.E5:.J5]) -> 100456.094189972
A6: IC | C6: C. Consultants and advisers | E6: 0 | F6: 0 | G6: 0 | H6: 0 | I6: 0 | J6: 0 | K6: of:=SUM([.E6:.J6]) -> 0
A7: ID | C7: D. Local consultants and advisers | E7: 0 | F7: 0 | G7: 0 | H7: 0 | I7: 0 | J7: 0 | K7: of:=SUM([.E7:.J7]) -> 0
A8: I | C8: Subtotal I | E8: of:=SUM([.E4:.E7]) -> 282366.109119588 | F8: of:=SUM([.F4:.F7]) -> 0 | G8: of:=SUM([.G4:.G7]) -> 0 | H8: of:=SUM([.H4:.H7]) -> 0 | I8: of:=SUM([.I4:.I7]) -> 0 | J8: of:=SUM([.J4:.J7]) -> 0 | K8: of:=SUM([.E8:.J8]) -> 282366.109119588
C10: II. Other direct programme costs
A11: IIA | C11: A. Activity costs | E11: of:=[.E12]+[.E15]+[.E19]+[.E25] -> 1283124.17991489 | F11: of:=[.F12]+[.F15]+[.F19]+[.F25] -> 0 | G11: of:=[.G12]+[.G15]+[.G19]+[.G25] -> 0 | H11: of:=[.H12]+[.H15]+[.H19]+[.H25] -> 0 | I11: of:=[.I12]+[.I15]+[.I19]+[.I25] -> 0 | J11: of:=[.J12]+[.J15]+[.J19]+[.J25] -> 0 | K11: of:=SUM([.E11:.J11]) -> 1283124.17991489
C12: Outcome 1 | E12: of:=SUM([.E13:.E14]) -> 226495.72780831 | F12: of:=SUM([.F13:.F14]) -> 0 | G12: of:=SUM([.G13:.G14]) -> 0 | H12: of:=SUM([.H13:.H14]) -> 0 | I12: of:=SUM([.I13:.I14]) -> 0 | J12: of:=SUM([.J13:.J14]) -> 0 | K12: of:=SUM([.E12:.J12]) -> 226495.72780831
C13: Output 1.1 | E13: 72649.57307059 | F13: 0 | G13: 0 | H13: 0 | I13: 0 | J13: 0 | K13: of:=SUM([.E13:.J13]) -> 72649.57307059
C14: Output 1.2 | E14: 153846.15473772 | F14: 0 | G14: 0 | H14: 0 | I14: 0 | J14: 0 | K14: of:=SUM([.E14:.J14]) -> 153846.15473772
C15: Outcome 2 | E15: of:=SUM([.E16:.E18]) -> 0 | F15: of:=SUM([.F16:.F18]) -> 0 | G15: of:=SUM([.G16:.G18]) -> 0 | H15: of:=SUM([.H16:.H18]) -> 0 | I15: of:=SUM([.I16:.I18]) -> 0 | J15: of:=SUM([.J16:.J18]) -> 0 | K15: of:=SUM([.E15:.J15]) -> 0
C16: Output 2.1 | E16: 0 | F16: 0 | G16: 0 | H16: 0 | I16: 0 | J16: 0 | K16: of:=SUM([.E16:.J16]) -> 0
C17: Output 2.2 | E17: 0 | F17: 0 | G17: 0 | H17: 0 | I17: 0 | J17: 0 | K17: of:=SUM([.E17:.J17]) -> 0
C18: Output 2.3 | E18: 0 | F18: 0 | G18: 0 | H18: 0 | I18: 0 | J18: 0 | K18: of:=SUM([.E18:.J18]) -> 0
C19: Outcome 3 | E19: of:=SUM([.E20:.E24]) -> 935141.23210658 | F19: of:=SUM([.F20:.F22]) -> 0 | G19: of:=SUM([.G20:.G22]) -> 0 | H19: of:=SUM([.H20:.H22]) -> 0 | I19: of:=SUM([.I20:.I22]) -> 0 | J19: of:=SUM([.J20:.J22]) -> 0 | K19: of:=SUM([.E19:.J19]) -> 935141.23210658
C20: Output 3.1 | E20: 863188.2149135 | F20: 0 | G20: 0 | H20: 0 | I20: 0 | J20: 0 | K20: of:=SUM([.E20:.J20]) -> 863188.2149135
C21: Output 3.2 | E21: 4560 | F21: 0 | G21: 0 | H21: 0 | I21: 0 | J21: 0 | K21: of:=SUM([.E21:.J21]) -> 4560
C22: Output 3.3 | E22: 17094.01719308 | F22: 0 | G22: 0 | H22: 0 | I22: 0 | J22: 0 | K22: of:=SUM([.E22:.J22]) -> 17094.01719308
C23: Output 3.4 | E23: 35299 | F23: 0 | G23: 0 | H23: 0 | I23: 0 | J23: 0 | K23: of:=SUM([.E23:.J23]) -> 35299
C24: Output 3.5 | E24: 15000 | F24: 0 | G24: 0 | H24: 0 | I24: 0 | J24: 0 | K24: of:=SUM([.E24:.J24]) -> 15000
C25: Outcome 4 | E25: of:=SUM([.E26:.E29]) -> 121487.22 | F25: of:=SUM([.F26:.F28]) -> 0 | G25: of:=SUM([.G26:.G28]) -> 0 | H25: of:=SUM([.H26:.H28]) -> 0 | I25: of:=SUM([.I26:.I28]) -> 0 | J25: of:=SUM([.J26:.J28]) -> 0 | K25: of:=SUM([.E25:.J25]) -> 121487.22
C26: Output 4.1 | E26: 82320.52 | F26: 0 | G26: 0 | H26: 0 | I26: 0 | J26: 0 | K26: of:=SUM([.E26:.J26]) -> 82320.52
C27: Output 4.2 | E27: 12000 | F27: 0 | G27: 0 | H27: 0 | I27: 0 | J27: 0 | K27: of:=SUM([.E27:.J27]) -> 12000
C28: Output 4.3 | E28: 27166.7 | F28: 0 | G28: 0 | H28: 0 | I28: 0 | J28: 0 | K28: of:=SUM([.E28:.J28]) -> 27166.7
C29: Output 4.4 | E29: 0 | F29: 0 | G29: 0 | H29: 0 | I29: 0 | J29: 0 | K29: of:=SUM([.E29:.J29]) -> 0
A30: IIB | C30: B. Costs of granting local NGOs | E30: 1018904.3438616 | F30: 0 | G30: 0 | H30: 0 | I30: 0 | J30: 0 | K30: of:=SUM([.E30:.J30]) -> 1018904.3438616
A31: IIC | C31: C. Activity-related travel costs | E31: 47222.23 | F31: 0 | G31: 0 | H31: 0 | I31: 0 | J31: 0 | K31: of:=SUM([.E31:.J31]) -> 47222.23
A32: IID | C32: D. Project office costs (if applicable) | E32: 80512.8208055514 | F32: 0 | G32: 0 | H32: 0 | I32: 0 | J32: 0 | K32: of:=SUM([.E32:.J32]) -> 80512.8208055514
A33: IIE | C33: E. Equipment and investments | E33: 10000 | F33: 0 | G33: 0 | H33: 0 | I33: 0 | J33: 0 | K33: of:=SUM([.E33:.J33]) -> 10000
A34: IIF | C34: F. Monitoring, evaluation and learning | E34: 0 | F34: 0 | G34: 0 | H34: 0 | I34: 0 | J34: 0 | K34: of:=SUM([.E34:.J34]) -> 0
A35: IIG | C35: G. Auditing | E35: 7000 | F35: 0 | G35: 0 | H35: 0 | I35: 0 | J35: 0 | K35: of:=SUM([.E35:.J35]) -> 7000
A36: II | C36: Subtotal II | E36: of:=[.E11]+SUM([.E31:.E35]) -> 1427859.23072044 | F36: of:=[.F11]+SUM([.F30:.F35]) -> 0 | G36: of:=[.G11]+SUM([.G30:.G35]) -> 0 | H36: of:=[.H11]+SUM([.H30:.H35]) -> 0 | I36: of:=[.I11]+SUM([.I30:.I35]) -> 0 | J36: of:=[.J11]+SUM([.J30:.J35]) -> 0 | K36: of:=SUM([.E36:.J36]) -> 1427859.23072044
C37: Total of I and II | E37: of:=[.E36]+[.E8] -> 1710225.33984003 | F37: of:=[.F36]+[.F8] -> 0 | G37: of:=[.G36]+[.G8] -> 0 | H37: of:=[.H36]+[.H8] -> 0 | I37: of:=[.I36]+[.I8] -> 0 | J37: of:=[.J36]+[.J8] -> 0 | K37: of:=[.K36]+[.K8] -> 1710225.33984003
D38: ICR lead party | E38: 0.09
C39: III. Overheads / indirect costs | D39: ICR local partners | E39: 0.0937086768880478
A40: IIIA | C40: A. ICR lead party | E40: of:=[.E38]*([.E8]+[.E11]+[.E31]+[.E32]+[.E33]+[.E34]+[.E35]) -> 153920.280585603 | F40: of:=[.F38]*[.F8]+[.F11]+[.F31]+[.F32]+[.F33]+[.F34]+[.F35] -> 0 | G40: of:=[.G38]*[.G8]+[.G11]+[.G31]+[.G32]+[.G33]+[.G34]+[.G35] -> 0 | H40: of:=[.H38]*[.H8]+[.H11]+[.H31]+[.H32]+[.H33]+[.H34]+[.H35] -> 0 | I40: of:=[.I38]*[.I8]+[.I11]+[.I31]+[.I32]+[.I33]+[.I34]+[.I35] -> 0 | J40: of:=[.J38]*[.J8]+[.J11]+[.J31]+[.J32]+[.J33]+[.J34]+[.J35] -> 0 | K40: of:=SUM([.E40:.J40]) -> 153920.280585603
A41: IIIB | C41: B. ICR local partners | E41: of:=[.E39]*[.E30] -> 95480.177938755 | F41: of:=[.F39]*[.F30] -> 0 | G41: of:=[.G39]*[.G30] -> 0 | H41: of:=[.H39]*[.H30] -> 0 | I41: of:=[.I39]*[.I30] -> 0 | J41: of:=[.J39]*[.J30] -> 0 | K41: of:=SUM([.E41:.J41]) -> 95480.177938755
A42: III | C42: Total of III | E42: of:=SUM([.E40:.E41]) -> 249400.458524358 | F42: of:=SUM([.F40:.F41]) -> 0 | G42: of:=SUM([.G40:.G41]) -> 0 | H42: of:=SUM([.H40:.H41]) -> 0 | I42: of:=SUM([.I40:.I41]) -> 0 | J42: of:=SUM([.J40:.J41]) -> 0 | K42: of:=SUM([.K40:.K41]) -> 249400.458524358
A43: IV | C43: Total of I, II and III | E43: of:=[.E42]+[.E36]+[.E8] -> 1959625.79836439 | F43: of:=[.F42]+[.F36]+[.F8] -> 0 | G43: of:=[.G42]+[.G36]+[.G8] -> 0 | H43: of:=[.H42]+[.H36]+[.H8] -> 0 | I43: of:=[.I42]+[.I36]+[.I8] -> 0 | J43: of:=[.J42]+[.J36]+[.J8] -> 0 | K43: of:=[.K42]+[.K36]+[.K8] -> 1959625.79836439
A44: V | C44: Contingencies (max. 4% of IV) | E44: 0 | F44: 0 | G44: 0 | H44: 0 | I44: 0 | J44: 0 | K44: of:=SUM([.E44:.J44]) -> 0
C45: TOTAL | E45: of:=[.E43]+[.E44] -> 1959625.79836439 | F45: of:=[.F43]+[.F44] -> 0 | G45: of:=[.G43]+[.G44] -> 0 | H45: of:=[.H43]+[.H44] -> 0 | I45: of:=[.I43]+[.I44] -> 0 | J45: of:=[.J43]+[.J44] -> 0 | K45: of:=SUM([.E45:.J45]) -> 1959625.79836439

Sheet: Annual_Budget_country_2025
B1: iati-identifier | C1: Budgets_country_2025
E2: Global | F2: Country 2 | G2: Country 3 | H2: Country 4 | I2: Country 5 | J2: Country 6 | K2: Total
B3: GB-COH-06368740-START-PROGRAM-2025 | C3: I. Direct staff costs
A4: IA | C4: A. Staff costs | E4: 281825.061847227 | F4: 0 | G4: 0 | H4: 0 | I4: 0 | J4: 0 | K4: of:=SUM([.E4:.J4]) -> 281825.061847227
A5: IB | C5: B. Local staff costs | E5: 109146.760627105 | F5: 0 | G5: 0 | H5: 0 | I5: 0 | J5: 0 | K5: of:=SUM([.E5:.J5]) -> 109146.760627105
A6: IC | C6: C. Consultants and advisers | E6: 42735.0429827 | F6: 0 | G6: 0 | H6: 0 | I6: 0 | J6: 0 | K6: of:=SUM([.E6:.J6]) -> 42735.0429827
A7: ID | C7: D. Local consultants and advisers | E7: 0 | F7: 0 | G7: 0 | H7: 0 | I7: 0 | J7: 0 | K7: of:=SUM([.E7:.J7]) -> 0
A8: I | C8: Subtotal I | E8: of:=SUM([.E4:.E7]) -> 433706.865457033 | F8: of:=SUM([.F4:.F7]) -> 0 | G8: of:=SUM([.G4:.G7]) -> 0 | H8: of:=SUM([.H4:.H7]) -> 0 | I8: of:=SUM([.I4:.I7]) -> 0 | J8: of:=SUM([.J4:.J7]) -> 0 | K8: of:=SUM([.E8:.J8]) -> 433706.865457033
C10: II. Other direct programme costs
A11: IIA | C11: A. Activity costs | E11: of:=[.E12]+[.E15]+[.E19]+[.E25] -> 2298283.45973911 | F11: of:=[.F12]+[.F15]+[.F19]+[.F25] -> 0 | G11: of:=[.G12]+[.G15]+[.G19]+[.G25] -> 0 | H11: of:=[.H12]+[.H15]+[.H19]+[.H25] -> 0 | I11: of:=[.I12]+[.I15]+[.I19]+[.I25] -> 0 | J11: of:=[.J12]+[.J15]+[.J19]+[.J25] -> 0 | K11: of:=SUM([.E11:.J11]) -> 2298283.45973911
C12: Outcome 1 | E12: of:=SUM([.E13:.E14]) -> 262931.61929966 | F12: of:=SUM([.F13:.F14]) -> 0 | G12: of:=SUM([.G13:.G14]) -> 0 | H12: of:=SUM([.H13:.H14]) -> 0 | I12: of:=SUM([.I13:.I14]) -> 0 | J12: of:=SUM([.J13:.J14]) -> 0 | K12: of:=SUM([.E12:.J12]) -> 262931.61929966
C13: Output 1.1 | E13: 63829.06017578 | F13: 0 | G13: 0 | H13: 0 | I13: 0 | J13: 0 | K13: of:=SUM([.E13:.J13]) -> 63829.06017578
C14: Output 1.2 | E14: 199102.55912388 | F14: 0 | G14: 0 | H14: 0 | I14: 0 | J14: 0 | K14: of:=SUM([.E14:.J14]) -> 199102.55912388
C15: Outcome 2 | E15: of:=SUM([.E16:.E18]) -> 123931.62464983 | F15: of:=SUM([.F16:.F18]) -> 0 | G15: of:=SUM([.G16:.G18]) -> 0 | H15: of:=SUM([.H16:.H18]) -> 0 | I15: of:=SUM([.I16:.I18]) -> 0 | J15: of:=SUM([.J16:.J18]) -> 0 | K15: of:=SUM([.E15:.J15]) -> 123931.62464983
C16: Output 2.1 | E16: 25641.02578962 | F16: 0 | G16: 0 | H16: 0 | I16: 0 | J16: 0 | K16: of:=SUM([.E16:.J16]) -> 25641.02578962
C17: Output 2.2 | E17: 85470.0859654 | F17: 0 | G17: 0 | H17: 0 | I17: 0 | J17: 0 | K17: of:=SUM([.E17:.J17]) -> 85470.0859654
C18: Output 2.3 | E18: 12820.51289481 | F18: 0 | G18: 0 | H18: 0 | I18: 0 | J18: 0 | K18: of:=SUM([.E18:.J18]) -> 12820.51289481
C19: Outcome 3 | E19: of:=SUM([.E20:.E24]) -> 1300450.12578962 | F19: of:=SUM([.F20:.F22]) -> 0 | G19: of:=SUM([.G20:.G22]) -> 0 | H19: of:=SUM([.H20:.H22]) -> 0 | I19: of:=SUM([.I20:.I22]) -> 0 | J19: of:=SUM([.J20:.J22]) -> 0 | K19: of:=SUM([.E19:.J19]) -> 1300450.12578962
C20: Output 3.1 | E20: 1017044.19 | F20: 0 | G20: 0 | H20: 0 | I20: 0 | J20: 0 | K20: of:=SUM([.E20:.J20]) -> 1017044.19
C21: Output 3.2 | E21: 116500 | F21: 0 | G21: 0 | H21: 0 | I21: 0 | J21: 0 | K21: of:=SUM([.E21:.J21]) -> 116500
C22: Output 3.3 | E22: 41777.76578962 | F22: 0 | G22: 0 | H22: 0 | I22: 0 | J22: 0 | K22: of:=SUM([.E22:.J22]) -> 41777.76578962
C23: Output 3.4 | E23: 95128.17 | F23: 0 | G23: 0 | H23: 0 | I23: 0 | J23: 0 | K23: of:=SUM([.E23:.J23]) -> 95128.17
C24: Output 3.5 | E24: 30000 | F24: 0 | G24: 0 | H24: 0 | I24: 0 | J24: 0 | K24: of:=SUM([.E24:.J24]) -> 30000
C25: Outcome 4 | E25: of:=SUM([.E26:.E29]) -> 610970.09 | F25: 0 | G25: 0 | H25: 0 | I25: 0 | J25: 0 | K25: of:=SUM([.E25:.J25]) -> 610970.09
C26: Output 4.1 | E26: 455970.09 | F26: 0 | G26: 0 | H26: 0 | I26: 0 | J26: 0 | K26: of:=SUM([.E26:.J26]) -> 455970.09
C27: Output 4.2 | E27: 25000 | F27: 0 | G27: 0 | H27: 0 | I27: 0 | J27: 0 | K27: of:=SUM([.E27:.J27]) -> 25000
C28: Output 4.3 | E28: 80000 | F28: 0 | G28: 0 | H28: 0 | I28: 0 | J28: 0 | K28: of:=SUM([.E28:.J28]) -> 80000
C29: Output 4.4 | E29: 50000 | F29: 0 | G29: 0 | H29: 0 | I29: 0 | J29: 0 | K29: of:=SUM([.E29:.J29]) -> 50000
A30: IIB | C30: B. Costs of granting local NGOs | E30: 1447987.43070312 | F30: 0 | G30: 0 | H30: 0 | I30: 0 | J30: 0 | K30: of:=SUM([.E30:.J30]) -> 1447987.43070312
A31: IIC | C31: C. Activity-related travel costs | E31: 97914.536877232 | F31: 0 | G31: 0 | H31: 0 | I31: 0 | J31: 0 | K31: of:=SUM([.E31:.J31]) -> 97914.536877232
A32: IID | C32: D. Project office costs (if applicable) | E32: 106616.718723371 | F32: 0 | G32: 0 | H32: 0 | I32: 0 | J32: 0 | K32: of:=SUM([.E32:.J32]) -> 106616.718723371
A33: IIE | C33: E. Equipment and investments | E33: 50512.82 | F33: 0 | G33: 0 | H33: 0 | I33: 0 | J33: 0 | K33: of:=SUM([.E33:.J33]) -> 50512.82
A34: IIF | C34: F. Monitoring, evaluation and learning | E34: 31914.53008789 | F34: 0 | G34: 0 | H34: 0 | I34: 0 | J34: 0 | K34: of:=SUM([.E34:.J34]) -> 31914.53008789
A35: IIG | C35: G. Auditing | E35: 7000 | F35: 0 | G35: 0 | H35: 0 | I35: 0 | J35: 0 | K35: of:=SUM([.E35:.J35]) -> 7000
A36: II | C36: Subtotal II | E36: of:=[.E11]+SUM([.E31:.E35]) -> 2592242.0654276 | F36: of:=[.F11]+SUM([.F30:.F35]) -> 0 | G36: of:=[.G11]+SUM([.G30:.G35]) -> 0 | H36: of:=[.H11]+SUM([.H30:.H35]) -> 0 | I36: of:=[.I11]+SUM([.I30:.I35]) -> 0 | J36: of:=[.J11]+SUM([.J30:.J35]) -> 0 | K36: of:=SUM([.E36:.J36]) -> 2592242.0654276
C37: Total of I and II | E37: of:=[.E36]+[.E8] -> 3025948.93088463 | F37: of:=[.F36]+[.F8] -> 0 | G37: of:=[.G36]+[.G8] -> 0 | H37: of:=[.H36]+[.H8] -> 0 | I37: of:=[.I36]+[.I8] -> 0 | J37: of:=[.J36]+[.J8] -> 0 | K37: of:=[.K36]+[.K8] -> 3025948.93088463
D38: ICR lead party | E38: 0.09
C39: III. Overheads / indirect costs | D39: ICR local partners | E39: 0.0930784304563105
A40: IIIA | C40: A. ICR lead party | E40: of:=[.E38]*[.E37] -> 272335.403779617 | F40: of:=[.F38]*[.F8]+[.F11]+[.F31]+[.F32]+[.F33]+[.F34]+[.F35] -> 0 | G40: of:=[.G38]*[.G8]+[.G11]+[.G31]+[.G32]+[.G33]+[.G34]+[.G35] -> 0 | H40: of:=[.H38]*[.H8]+[.H11]+[.H31]+[.H32]+[.H33]+[.H34]+[.H35] -> 0 | I40: of:=[.I38]*[.I8]+[.I11]+[.I31]+[.I32]+[.I33]+[.I34]+[.I35] -> 0 | J40: of:=[.J38]*[.J8]+[.J11]+[.J31]+[.J32]+[.J33]+[.J34]+[.J35] -> 0 | K40: of:=SUM([.E40:.J40]) -> 272335.403779617
A41: IIIB | C41: B. ICR local partners | E41: of:=[.E39]*[.E30] -> 134776.397370312 | F41: of:=[.F39]*[.F30] -> 0 | G41: of:=[.G39]*[.G30] -> 0 | H41: of:=[.H39]*[.H30] -> 0 | I41: of:=[.I39]*[.I30] -> 0 | J41: of:=[.J39]*[.J30] -> 0 | K41: of:=SUM([.E41:.J41]) -> 134776.397370312
A42: III | C42: Total of III | E42: of:=SUM([.E40:.E41]) -> 407111.801149929 | F42: of:=SUM([.F40:.F41]) -> 0 | G42: of:=SUM([.G40:.G41]) -> 0 | H42: of:=SUM([.H40:.H41]) -> 0 | I42: of:=SUM([.I40:.I41]) -> 0 | J42: of:=SUM([.J40:.J41]) -> 0 | K42: of:=SUM([.K40:.K41]) -> 407111.801149929
A43: IV | C43: Total of I, II and III | E43: of:=[.E42]+[.E37] -> 3433060.73203456 | F43: of:=[.F42]+[.F36]+[.F8] -> 0 | G43: of:=[.G42]+[.G36]+[.G8] -> 0 | H43: of:=[.H42]+[.H36]+[.H8] -> 0 | I43: of:=[.I42]+[.I36]+[.I8] -> 0 | J43: of:=[.J42]+[.J36]+[.J8] -> 0 | K43: of:=[.K8]+[.K36]+[.K42] -> 3433060.73203456
A44: V | C44: Contingencies (max. 4% of IV) | E44: 0 | F44: 0 | G44: 0 | H44: 0 | I44: 0 | J44: 0 | K44: of:=SUM([.E44:.J44]) -> 0
C45: TOTAL | E45: of:=[.E43]+[.E44] -> 3433060.73203456 | F45: of:=[.F43]+[.F44] -> 0 | G45: of:=[.G43]+[.G44] -> 0 | H45: of:=[.H43]+[.H44] -> 0 | I45: of:=[.I43]+[.I44] -> 0 | J45: of:=[.J43]+[.J44] -> 0 | K45: of:=SUM([.E45:.J45]) -> 3433060.73203456

Sheet: Annual_Budget_country_2026
B1: iati-identifier | C1: Budgets_country_2026
E2: Global | F2: Country 2 | G2: Country 3 | H2: Country 4 | I2: Country 5 | J2: Country 6 | K2: Total
B3: GB-COH-06368740-START-PROGRAM-2026 | C3: I. Direct staff costs
A4: IA | C4: A. Staff costs | E4: 283897.068931909 | F4: 0 | G4: 0 | H4: 0 | I4: 0 | J4: 0 | K4: of:=SUM([.E4:.J4]) -> 283897.068931909
A5: IB | C5: B. Local staff costs | E5: 98340.2029632108 | F5: 0 | G5: 0 | H5: 0 | I5: 0 | J5: 0 | K5: of:=SUM([.E5:.J5]) -> 98340.2029632108
A6: IC | C6: C. Consultants and advisers | E6: 42735.0429827 | F6: 0 | G6: 0 | H6: 0 | I6: 0 | J6: 0 | K6: of:=SUM([.E6:.J6]) -> 42735.0429827
A7: ID | C7: D. Local consultants and advisers | E7: 0 | F7: 0 | G7: 0 | H7: 0 | I7: 0 | J7: 0 | K7: of:=SUM([.E7:.J7]) -> 0
A8: I | C8: Subtotal I | E8: of:=SUM([.E4:.E7]) -> 424972.314877819 | F8: of:=SUM([.F4:.F7]) -> 0 | G8: of:=SUM([.G4:.G7]) -> 0 | H8: of:=SUM([.H4:.H7]) -> 0 | I8: of:=SUM([.I4:.I7]) -> 0 | J8: of:=SUM([.J4:.J7]) -> 0 | K8: of:=SUM([.E8:.J8]) -> 424972.314877819
C10: II. Other direct programme costs
A11: IIA | C11: A. Activity costs | E11: of:=[.E12]+[.E15]+[.E19]+[.E25] -> 2237396.40267925 | F11: of:=[.F12]+[.F15]+[.F19]+[.F25] -> 0 | G11: of:=[.G12]+[.G15]+[.G19]+[.G25] -> 0 | H11: of:=[.H12]+[.H15]+[.H19]+[.H25] -> 0 | I11: of:=[.I12]+[.I15]+[.I19]+[.I25] -> 0 | J11: of:=[.J12]+[.J15]+[.J19]+[.J25] -> 0 | K11: of:=SUM([.E11:.J11]) -> 2237396.40267925
C12: Outcome 1 | E12: of:=SUM([.E13:.E14]) -> 354811.971712465 | F12: of:=SUM([.F13:.F14]) -> 0 | G12: of:=SUM([.G13:.G14]) -> 0 | H12: of:=SUM([.H13:.H14]) -> 0 | I12: of:=SUM([.I13:.I14]) -> 0 | J12: of:=SUM([.J13:.J14]) -> 0 | K12: of:=SUM([.E12:.J12]) -> 354811.971712465
C13: Output 1.1 | E13: 115111.11175502 | F13: 0 | G13: 0 | H13: 0 | I13: 0 | J13: 0 | K13: of:=SUM([.E13:.J13]) -> 115111.11175502
C14: Output 1.2 | E14: 239700.859957445 | F14: 0 | G14: 0 | H14: 0 | I14: 0 | J14: 0 | K14: of:=SUM([.E14:.J14]) -> 239700.859957445
C15: Outcome 2 | E15: of:=SUM([.E16:.E18]) -> 98290.5988602099 | F15: of:=SUM([.F16:.F18]) -> 0 | G15: of:=SUM([.G16:.G18]) -> 0 | H15: of:=SUM([.H16:.H18]) -> 0 | I15: of:=SUM([.I16:.I18]) -> 0 | J15: of:=SUM([.J16:.J18]) -> 0 | K15: of:=SUM([.E15:.J15]) -> 98290.5988602099
C16: Output 2.1 | E16: 0 | F16: 0 | G16: 0 | H16: 0 | I16: 0 | J16: 0 | K16: of:=SUM([.E16:.J16]) -> 0
C17: Output 2.2 | E17: 85470.0859654 | F17: 0 | G17: 0 | H17: 0 | I17: 0 | J17: 0 | K17: of:=SUM([.E17:.J17]) -> 85470.0859654
C18: Output 2.3 | E18: 12820.51289481 | F18: 0 | G18: 0 | H18: 0 | I18: 0 | J18: 0 | K18: of:=SUM([.E18:.J18]) -> 12820.51289481
C19: Outcome 3 | E19: of:=SUM([.E20:.E24]) -> 1054558.79210658 | F19: of:=SUM([.F20:.F22]) -> 0 | G19: of:=SUM([.G20:.G22]) -> 0 | H19: of:=SUM([.H20:.H22]) -> 0 | I19: of:=SUM([.I20:.I22]) -> 0 | J19: of:=SUM([.J20:.J22]) -> 0 | K19: of:=SUM([.E19:.J19]) -> 1054558.79210658
C20: Output 3.1 | E20: 854268.2149135 | F20: 0 | G20: 0 | H20: 0 | I20: 0 | J20: 0 | K20: of:=SUM([.E20:.J20]) -> 854268.2149135
C21: Output 3.2 | E21: 20000 | F21: 0 | G21: 0 | H21: 0 | I21: 0 | J21: 0 | K21: of:=SUM([.E21:.J21]) -> 20000
C22: Output 3.3 | E22: 25162.40719308 | F22: 0 | G22: 0 | H22: 0 | I22: 0 | J22: 0 | K22: of:=SUM([.E22:.J22]) -> 25162.40719308
C23: Output 3.4 | E23: 95128.17 | F23: 0 | G23: 0 | H23: 0 | I23: 0 | J23: 0 | K23: of:=SUM([.E23:.J23]) -> 95128.17
C24: Output 3.5 | E24: 60000 | F24: 0 | G24: 0 | H24: 0 | I24: 0 | J24: 0 | K24: of:=SUM([.E24:.J24]) -> 60000
C25: Outcome 4 | E25: of:=SUM([.E26:.E29]) -> 729735.04 | F25: 0 | G25: 0 | H25: 0 | I25: 0 | J25: 0 | K25: of:=SUM([.E25:.J25]) -> 729735.04
C26: Output 4.1 | E26: 552735.04 | F26: 0 | G26: 0 | H26: 0 | I26: 0 | J26: 0 | K26: of:=SUM([.E26:.J26]) -> 552735.04
C27: Output 4.2 | E27: 32000 | F27: 0 | G27: 0 | H27: 0 | I27: 0 | J27: 0 | K27: of:=SUM([.E27:.J27]) -> 32000
C28: Output 4.3 | E28: 80000 | F28: 0 | G28: 0 | H28: 0 | I28: 0 | J28: 0 | K28: of:=SUM([.E28:.J28]) -> 80000
C29: Output 4.4 | E29: 65000 | F29: 0 | G29: 0 | H29: 0 | I29: 0 | J29: 0 | K29: of:=SUM([.E29:.J29]) -> 65000
A30: IIB | C30: B. Costs of granting local NGOs | E30: 1637772.49000278 | F30: 0 | G30: 0 | H30: 0 | I30: 0 | J30: 0 | K30: of:=SUM([.E30:.J30]) -> 1637772.49000278
A31: IIC | C31: C. Activity-related travel costs | E31: 76799.146877232 | F31: 0 | G31: 0 | H31: 0 | I31: 0 | J31: 0 | K31: of:=SUM([.E31:.J31]) -> 76799.146877232
A32: IID | C32: D. Project office costs (if applicable) | E32: 95555.55587751 | F32: 0 | G32: 0 | H32: 0 | I32: 0 | J32: 0 | K32: of:=SUM([.E32:.J32]) -> 95555.55587751
A33: IIE | C33: E. Equipment and investments | E33: 50512.82 | F33: 0 | G33: 0 | H33: 0 | I33: 0 | J33: 0 | K33: of:=SUM([.E33:.J33]) -> 50512.82
A34: IIF | C34: F. Monitoring, evaluation and learning | E34: 14000 | F34: 0 | G34: 0 | H34: 0 | I34: 0 | J34: 0 | K34: of:=SUM([.E34:.J34]) -> 14000
A35: IIG | C35: G. Auditing | E35: 7000 | F35: 0 | G35: 0 | H35: 0 | I35: 0 | J35: 0 | K35: of:=SUM([.E35:.J35]) -> 7000
A36: II | C36: Subtotal II | E36: of:=[.E11]+SUM([.E31:.E35]) -> 2481263.925434 | F36: of:=[.F11]+SUM([.F30:.F35]) -> 0 | G36: of:=[.G11]+SUM([.G30:.G35]) -> 0 | H36: of:=[.H11]+SUM([.H30:.H35]) -> 0 | I36: of:=[.I11]+SUM([.I30:.I35]) -> 0 | J36: of:=[.J11]+SUM([.J30:.J35]) -> 0 | K36: of:=SUM([.E36:.J36]) -> 2481263.925434
C37: Total of I and II | E37: of:=[.E36]+[.E8] -> 2906236.24031182 | F37: of:=[.F36]+[.F8] -> 0 | G37: of:=[.G36]+[.G8] -> 0 | H37: of:=[.H36]+[.H8] -> 0 | I37: of:=[.I36]+[.I8] -> 0 | J37: of:=[.J36]+[.J8] -> 0 | K37: of:=[.K36]+[.K8] -> 2906236.24031182
D38: ICR lead party | E38: 0.09
C39: III. Overheads / indirect costs | D39: ICR local partners | E39: 0.0960859908891289
A40: IIIA | C40: A. ICR lead party | E40: of:=[.E38]*[.E37] -> 261561.261628063 | F40: of:=[.F38]*[.F8]+[.F11]+[.F31]+[.F32]+[.F33]+[.F34]+[.F35] -> 0 | G40: of:=[.G38]*[.G8]+[.G11]+[.G31]+[.G32]+[.G33]+[.G34]+[.G35] -> 0 | H40: of:=[.H38]*[.H8]+[.H11]+[.H31]+[.H32]+[.H33]+[.H34]+[.H35] -> 0 | I40: of:=[.I38]*[.I8]+[.I11]+[.I31]+[.I32]+[.I33]+[.I34]+[.I35] -> 0 | J40: of:=[.J38]*[.J8]+[.J11]+[.J31]+[.J32]+[.J33]+[.J34]+[.J35] -> 0 | K40: of:=SUM([.E40:.J40]) -> 261561.261628063
A41: IIIB | C41: B. ICR local partners | E41: of:=[.E39]*[.E30] -> 157366.992552873 | F41: of:=[.F39]*[.F30] -> 0 | G41: of:=[.G39]*[.G30] -> 0 | H41: of:=[.H39]*[.H30] -> 0 | I41: of:=[.I39]*[.I30] -> 0 | J41: of:=[.J39]*[.J30] -> 0 | K41: of:=SUM([.E41:.J41]) -> 157366.992552873
A42: III | C42: Total of III | E42: of:=SUM([.E40:.E41]) -> 418928.254180936 | F42: of:=SUM([.F40:.F41]) -> 0 | G42: of:=SUM([.G40:.G41]) -> 0 | H42: of:=SUM([.H40:.H41]) -> 0 | I42: of:=SUM([.I40:.I41]) -> 0 | J42: of:=SUM([.J40:.J41]) -> 0 | K42: of:=SUM([.K40:.K41]) -> 418928.254180936
A43: IV | C43: Total of I, II and III | E43: of:=[.E42]+[.E37] -> 3325164.49449275 | F43: of:=[.F8]+[.F36]+[.F42] -> 0 | G43: of:=[.G8]+[.G36]+[.G42] -> 0 | H43: of:=[.H8]+[.H36]+[.H42] -> 0 | I43: of:=[.I8]+[.I36]+[.I42] -> 0 | J43: of:=[.J8]+[.J36]+[.J42] -> 0 | K43: of:=[.K8]+[.K36]+[.K42] -> 3325164.49449275
A44: V | C44: Contingencies (max. 4% of IV) | E44: 0 | F44: 0 | G44: 0 | H44: 0 | I44: 0 | J44: 0 | K44: of:=SUM([.E44:.J44]) -> 0
C45: TOTAL | E45: of:=[.E43]+[.E44] -> 3325164.49449275 | F45: of:=[.F43]+[.F44] -> 0 | G45: of:=[.G43]+[.G44] -> 0 | H45: of:=[.H43]+[.H44] -> 0 | I45: of:=[.I43]+[.I44] -> 0 | J45: of:=[.J43]+[.J44] -> 0 | K45: of:=SUM([.E45:.J45]) -> 3325164.49449275

Sheet: Annual_Budget_country_2027
B1: iati-identifier | C1: Budgets_country_2027
E2: Global | F2: Country 2 | G2: Country 3 | H2: Country 4 | I2: Country 5 | J2: Country 6 | K2: Total
B3: GB-COH-06368740-START-PROGRAM-2027 | C3: I. Direct staff costs
A4: IA | C4: A. Staff costs | E4: 292624.453070662 | F4: 0 | G4: 0 | H4: 0 | I4: 0 | J4: 0 | K4: of:=SUM([.E4:.J4]) -> 292624.453070662
A5: IB | C5: B. Local staff costs | E5: 101168.999721997 | F5: 0 | G5: 0 | H5: 0 | I5: 0 | J5: 0 | K5: of:=SUM([.E5:.J5]) -> 101168.999721997
A6: IC | C6: C. Consultants and advisers | E6: 85470.0859654 | F6: 0 | G6: 0 | H6: 0 | I6: 0 | J6: 0 | K6: of:=SUM([.E6:.J6]) -> 85470.0859654
A7: ID | C7: D. Local consultants and advisers | E7: 0 | F7: 0 | G7: 0 | H7: 0 | I7: 0 | J7: 0 | K7: of:=SUM([.E7:.J7]) -> 0
A8: I | C8: Subtotal I | E8: of:=SUM([.E4:.E7]) -> 479263.538758059 | F8: of:=SUM([.F4:.F7]) -> 0 | G8: of:=SUM([.G4:.G7]) -> 0 | H8: of:=SUM([.H4:.H7]) -> 0 | I8: of:=SUM([.I4:.I7]) -> 0 | J8: of:=SUM([.J4:.J7]) -> 0 | K8: of:=SUM([.E8:.J8]) -> 479263.538758059
C10: II. Other direct programme costs
A11: IIA | C11: A. Activity costs | E11: of:=[.E12]+[.E15]+[.E19]+[.E25] -> 2440058.42957196 | F11: of:=[.F12]+[.F15]+[.F19]+[.F25] -> 0 | G11: of:=[.G12]+[.G15]+[.G19]+[.G25] -> 0 | H11: of:=[.H12]+[.H15]+[.H19]+[.H25] -> 0 | I11: of:=[.I12]+[.I15]+[.I19]+[.I25] -> 0 | J11: of:=[.J12]+[.J15]+[.J19]+[.J25] -> 0 | K11: of:=SUM([.E11:.J11]) -> 2440058.42957196
C12: Outcome 1 | E12: of:=SUM([.E13:.E14]) -> 312076.928729765 | F12: of:=SUM([.F13:.F14]) -> 0 | G12: of:=SUM([.G13:.G14]) -> 0 | H12: of:=SUM([.H13:.H14]) -> 0 | I12: of:=SUM([.I13:.I14]) -> 0 | J12: of:=SUM([.J13:.J14]) -> 0 | K12: of:=SUM([.E12:.J12]) -> 312076.928729765
C13: Output 1.1 | E13: 132205.1289481 | F13: 0 | G13: 0 | H13: 0 | I13: 0 | J13: 0 | K13: of:=SUM([.E13:.J13]) -> 132205.1289481
C14: Output 1.2 | E14: 179871.799781665 | F14: 0 | G14: 0 | H14: 0 | I14: 0 | J14: 0 | K14: of:=SUM([.E14:.J14]) -> 179871.799781665
C15: Outcome 2 | E15: of:=SUM([.E16:.E18]) -> 226495.72780831 | F15: of:=SUM([.F16:.F18]) -> 0 | G15: of:=SUM([.G16:.G18]) -> 0 | H15: of:=SUM([.H16:.H18]) -> 0 | I15: of:=SUM([.I16:.I18]) -> 0 | J15: of:=SUM([.J16:.J18]) -> 0 | K15: of:=SUM([.E15:.J15]) -> 226495.72780831
C16: Output 2.1 | E16: 0 | F16: 0 | G16: 0 | H16: 0 | I16: 0 | J16: 0 | K16: of:=SUM([.E16:.J16]) -> 0
C17: Output 2.2 | E17: 213675.2149135 | F17: 0 | G17: 0 | H17: 0 | I17: 0 | J17: 0 | K17: of:=SUM([.E17:.J17]) -> 213675.2149135
C18: Output 2.3 | E18: 12820.51289481 | F18: 0 | G18: 0 | H18: 0 | I18: 0 | J18: 0 | K18: of:=SUM([.E18:.J18]) -> 12820.51289481
C19: Outcome 3 | E19: of:=SUM([.E20:.E24]) -> 1059281.05210658 | F19: of:=SUM([.F20:.F22]) -> 0 | G19: of:=SUM([.G20:.G22]) -> 0 | H19: of:=SUM([.H20:.H22]) -> 0 | I19: of:=SUM([.I20:.I22]) -> 0 | J19: of:=SUM([.J20:.J22]) -> 0 | K19: of:=SUM([.E19:.J19]) -> 1059281.05210658
C20: Output 3.1 | E20: 851768.2149135 | F20: 0 | G20: 0 | H20: 0 | I20: 0 | J20: 0 | K20: of:=SUM([.E20:.J20]) -> 851768.2149135
C21: Output 3.2 | E21: 25170.94 | F21: 0 | G21: 0 | H21: 0 | I21: 0 | J21: 0 | K21: of:=SUM([.E21:.J21]) -> 25170.94
C22: Output 3.3 | E22: 25162.39719308 | F22: 0 | G22: 0 | H22: 0 | I22: 0 | J22: 0 | K22: of:=SUM([.E22:.J22]) -> 25162.39719308
C23: Output 3.4 | E23: 97179.5 | F23: 0 | G23: 0 | H23: 0 | I23: 0 | J23: 0 | K23: of:=SUM([.E23:.J23]) -> 97179.5
C24: Output 3.5 | E24: 60000 | F24: 0 | G24: 0 | H24: 0 | I24: 0 | J24: 0 | K24: of:=SUM([.E24:.J24]) -> 60000
C25: Outcome 4 | E25: of:=SUM([.E26:.E29]) -> 842204.720927304 | F25: of:=SUM([.F26:.F28]) -> 0 | G25: of:=SUM([.G26:.G28]) -> 0 | H25: of:=SUM([.H26:.H28]) -> 0 | I25: of:=SUM([.I26:.I28]) -> 0 | J25: of:=SUM([.J26:.J28]) -> 0 | K25: of:=SUM([.E25:.J25]) -> 842204.720927304
C26: Output 4.1 | E26: 647077.66 | F26: 0 | G26: 0 | H26: 0 | I26: 0 | J26: 0 | K26: of:=SUM([.E26:.J26]) -> 647077.66
C27: Output 4.2 | E27: 36175.8109273036 | F27: 0 | G27: 0 | H27: 0 | I27: 0 | J27: 0 | K27: of:=SUM([.E27:.J27]) -> 36175.8109273036
C28: Output 4.3 | E28: 82327.32 | F28: 0 | G28: 0 | H28: 0 | I28: 0 | J28: 0 | K28: of:=SUM([.E28:.J28]) -> 82327.32
C29: Output 4.4 | E29: 76623.93 | F29: 0 | G29: 0 | H29: 0 | I29: 0 | J29: 0 | K29: of:=SUM([.E29:.J29]) -> 76623.93
A30: IIB | C30: B. Costs of granting local NGOs | E30: 1812115.1087751 | F30: 0 | G30: 0 | H30: 0 | I30: 0 | J30: 0 | K30: of:=SUM([.E30:.J30]) -> 1812115.1087751
A31: IIC | C31: C. Activity-related travel costs | E31: 73269.216877232 | F31: 0 | G31: 0 | H31: 0 | I31: 0 | J31: 0 | K31: of:=SUM([.E31:.J31]) -> 73269.216877232
A32: IID | C32: D. Project office costs (if applicable) | E32: 107948.71587751 | F32: 0 | G32: 0 | H32: 0 | I32: 0 | J32: 0 | K32: of:=SUM([.E32:.J32]) -> 107948.71587751
A33: IIE | C33: E. Equipment and investments | E33: 50512.82 | F33: 0 | G33: 0 | H33: 0 | I33: 0 | J33: 0 | K33: of:=SUM([.E33:.J33]) -> 50512.82
A34: IIF | C34: F. Monitoring, evaluation and learning | E34: 54170.94008789 | F34: 0 | G34: 0 | H34: 0 | I34: 0 | J34: 0 | K34: of:=SUM([.E34:.J34]) -> 54170.94008789
A35: IIG | C35: G. Auditing | E35: 7000 | F35: 0 | G35: 0 | H35: 0 | I35: 0 | J35: 0 | K35: of:=SUM([.E35:.J35]) -> 7000
A36: II | C36: Subtotal II | E36: of:=[.E11]+SUM([.E31:.E35]) -> 2732960.12241459 | F36: of:=[.F11]+SUM([.F30:.F35]) -> 0 | G36: of:=[.G11]+SUM([.G30:.G35]) -> 0 | H36: of:=[.H11]+SUM([.H30:.H35]) -> 0 | I36: of:=[.I11]+SUM([.I30:.I35]) -> 0 | J36: of:=[.J11]+SUM([.J30:.J35]) -> 0 | K36: of:=SUM([.E36:.J36]) -> 2732960.12241459
C37: Total of I and II | E37: of:=[.E36]+[.E8] -> 3212223.66117265 | F37: of:=[.F36]+[.F8] -> 0 | G37: of:=[.G36]+[.G8] -> 0 | H37: of:=[.H36]+[.H8] -> 0 | I37: of:=[.I36]+[.I8] -> 0 | J37: of:=[.J36]+[.J8] -> 0 | K37: of:=[.K36]+[.K8] -> 3212223.66117265
D38: ICR lead party | E38: 0.09
C39: III. Overheads / indirect costs | D39: ICR local partners | E39: 0.0964625555979509
A40: IIIA | C40: A. ICR lead party | E40: of:=[.E38]*[.E37] -> 289100.129505538 | F40: of:=[.F38]*[.F8]+[.F11]+[.F31]+[.F32]+[.F33]+[.F34]+[.F35] -> 0 | G40: of:=[.G38]*[.G8]+[.G11]+[.G31]+[.G32]+[.G33]+[.G34]+[.G35] -> 0 | H40: of:=[.H38]*[.H8]+[.H11]+[.H31]+[.H32]+[.H33]+[.H34]+[.H35] -> 0 | I40: of:=[.I38]*[.I8]+[.I11]+[.I31]+[.I32]+[.I33]+[.I34]+[.I35] -> 0 | J40: of:=[.J38]*[.J8]+[.J11]+[.J31]+[.J32]+[.J33]+[.J34]+[.J35] -> 0 | K40: of:=SUM([.E40:.J40]) -> 289100.129505538
A41: IIIB | C41: B. ICR local partners | E41: of:=[.E39]*[.E30] -> 174801.254430105 | F41: of:=[.F39]*[.F30] -> 0 | G41: of:=[.G39]*[.G30] -> 0 | H41: of:=[.H39]*[.H30] -> 0 | I41: of:=[.I39]*[.I30] -> 0 | J41: of:=[.J39]*[.J30] -> 0 | K41: of:=SUM([.E41:.J41]) -> 174801.254430105
A42: III | C42: Total of III | E42: of:=SUM([.E40:.E41]) -> 463901.383935643 | F42: of:=SUM([.F40:.F41]) -> 0 | G42: of:=SUM([.G40:.G41]) -> 0 | H42: of:=SUM([.H40:.H41]) -> 0 | I42: of:=SUM([.I40:.I41]) -> 0 | J42: of:=SUM([.J40:.J41]) -> 0 | K42: of:=SUM([.K40:.K41]) -> 463901.383935643
A43: IV | C43: Total of I, II and III | E43: of:=[.E42]+[.E37] -> 3676125.04510829 | F43: of:=[.F8]+[.F36]+[.F42] -> 0 | G43: of:=[.G8]+[.G36]+[.G42] -> 0 | H43: of:=[.H8]+[.H36]+[.H42] -> 0 | I43: of:=[.I8]+[.I36]+[.I42] -> 0 | J43: of:=[.J8]+[.J36]+[.J42] -> 0 | K43: of:=[.K8]+[.K36]+[.K42] -> 3676125.04510829
A44: V | C44: Contingencies (max. 4% of IV) | E44: 0 | F44: 0 | G44: 0 | H44: 0 | I44: 0 | J44: 0 | K44: of:=SUM([.E44:.J44]) -> 0
C45: TOTAL | E45: of:=[.E43]+[.E44] -> 3676125.04510829 | F45: of:=[.F43]+[.F44] -> 0 | G45: of:=[.G43]+[.G44] -> 0 | H45: of:=[.H43]+[.H44] -> 0 | I45: of:=[.I43]+[.I44] -> 0 | J45: of:=[.J43]+[.J44] -> 0 | K45: of:=SUM([.E45:.J45]) -> 3676125.04510829

Sheet: Logframe
A1: Description_of_expected_results | B1: Indicators | C1: Baseline_year | D1: Target_End | E1: Target_2024 | F1: Target_2025 | G1: Target_2026 | H1: Target_2027 | I1: Means_of_Verification
A2: Outcome 1: | B2: Expand network of humanitarian hubs | C2: n/a | D2: n/a | E2: n/a | F2: n/a | G2: n/a | H2: n/a | I2: Qualitative indicator: narrative based on the indicators below.
A3: Output 1.1 | B3: Hubs: # mature (% of total) | C3: 0 | D3: 5 (33%) | E3: 0 | F3: 1 (7%) | G3: 1 (7%) | H3: 3 (20%) | I3: Hub documentation, data from hub progress measurement
A4: Output 1.2 | B4: Total number of hubs | C4: 10 | D4: 15 | E4: 10 | F4: 2 | G4: 2 | H4: 1 | I4: Hub documentation (e..g, hub agreements)
A5: Output 1.3 | B5: Hubs: # in incubation | C5: 10 | D5: 10 | E5: 10 | F5: 9 | G5: 14 | H5: 10 | I5: Hub documentation, data from hub progress measurement
A6: Outcome 2: | B6: Scope, test and operationalise locally-led/designed tools and approaches to the anticipation of the humanitarian impact of conflict and man-made risks. | C6: n/a | D6: n/a | E6: n/a | F6: n/a | G6: n/a | H6: n/a | I6: Qualitative indicator: narrative based on the indicators below.
A7: Output 2.1 | B7: # of SF projects implemented as a result of forecasted hazard identified by tools | C7: n/a | D7: TBC | E7: TBC | F7: TBC | G7: TBC | H7: TBC | I7: Start Fund project reports, anticipation tool reports
A8: Output 2.1i | B8: i) # of corresponding member organisations that have used tools to forecast hazards | C8: n/a | D8: TBC | E8: TBC | F8: TBC | G8: TBC | H8: TBC | I8: Start Fund project reports
A9: Output 2.2 | B9: # of country/context specific tools that are developed | C9: 0 | D9: 4 tools adapted to at least 2 contexts | E9: 0 | F9: 1 tool adapted to at least 1 context | G9: 1 tool adapted to at least 2 contexts | H9: 2 tools adapted to at least 2 contexts | I9: anticipation tool reports
A10: Output 2.3 | B10: # of trainings/workshops for members to scale up anticipatory action interventions to prevent the humanitarian effect of man-made crises | C10: n/a | D10: 4 | E10: n/a | F10: 1 design workshop | G10: 2 (1 for each country/context) | H10: 1 final learning event | I10: internal documentation, training schedule
A11: Outcome 3: | B11: (a) Upscale the involvement of national and local organisations in decision making and (b) Improve their access to international funding,and (c) share best practices related to the above with other pooled funds | C11: n/a | D11: n/a | E11: n/a | F11: n/a | G11: n/a | H11: n/a | I11: Qualitative indicator: narrative based on the indicators below.
A12: Output 3.1a | B12: % (#) of member LNNGOs which submit proposals in countries where an alert has been raised (this should only include LNNGOs which have been onboarded) | C12: 0.75 | D12: 0.78 | E12: 0.75 | F12: 0.75 | G12: 0.78 | H12: 0.78 | I12: Standard Start Fund alert data collection
A13: Output 3.1b | B13: % of funding to Local/National NGOs (disaggregated by: i) direct (global Start Fund) ii) direct (Start Fund Bangladesh) (iii) in countries where we have LNNGO presence (global SF) | C13: i) 11% ii) 52% iii) 48% | D13: i) 15% ii) 55% iii) 54% | E13: i) 11% ii) 52% iii) 48% | F13: i) 13% ii) 53% iii) 50% | G13: i) 15% ii) 54% iii) 52% | H13: i) 15% ii) 55% iii) 54% | I13: Standard Start Fund alert data collection
A14: Output 3.1c | B14: % of projects with an LNNGO as convening agency in countries where we have LNNGO members (disaggregated by (i) Global Start Fund and (ii) Start Fund Bangladesh) | C14: i) 46% ii) 71% | D14: i) 52% ii) 75% | E14: i) 46% ii) 71% | F14: i) 48% ii) 72% | G14: i) 50% ii) 73% | H14: i) 52% ii) 75% | I14: Start Fund project reports
A15: Output 3.1d | B15: # of learning events with other pooled funds | C15: 1 | D15: 4 | E15: 1 | F15: 1 | G15: 1 | H15: 1 | I15: internal documentation, event schedule
A16: Output 3.2 | B16: # of trainings provided to LLNGOs on implementing key humanitarian principles and enhanced local leadership and governance | C16: 1 | D16: 3 | E16: 0 | F16: 1 | G16: 1 | H16: 1 | I16: training reports
A17: Output 3.3 | B17: # of mentors across various countries trained to provide ongoing support and guidance to member organizations | C17: 1 | D17: 3 | E17: 0 | F17: 0 | G17: 2 | H17: 1 | I17: recorded mentor agreements | J17: MISSING: LEARNING GRANT ICR, POOLED FUNDS
A18: Output 3.4 | B18: # of evaluations/research pieces related to the impact of strengthening local leadership and localisation practices | C18: 0 | D18: 3 | E18: 0 | F18: 1 | G18: 1 | H18: 1 | I18: evaluation / research outputs
A19: Output 3.5 | B19: # of Learning Grants awarded to LLNGOs | C19: n/a | D19: 11 | E19: 1 | F19: 2 | G19: 4 | H19: 4 | I19: Standard Start Fund learning grant data collection
A20: Outcome 4: | B20: (a) Support BAU (business as usual) due diligence processes for local and national members, and b) support innovative approaches to due diligence, risk, and compliance through learning iterations and testing of initiatives to support local and national members (b) support innovation initiatives for hubs, and support local humanitarians to take the lead in identifying local solutions to local problems. | C20: n/a | D20: n/a | E20: n/a | F20: n/a | G20: n/a | H20: n/a | I20: Qualitative indicator: narrative based on the indicators below.
A21: Output 4.1 | B21: a) # member local and national organisations that have progressed through due diligence ai) # of organisations that participated in DD innovation pilot and feel better supported by our compliance systems b) # community-led innovation initiatives co-designed and run with hubs | C21: N/A | D21: b)9 | E21: a) n/a ai) baseline to be collected in Jan '25 b) 1 | F21: a)23 ai) dependent on baseline b) 2 | G21: a)15 ai) dependent on baseline b) 3 | H21: a) ai) b) 3 | I21: a) due diligence records ai) due diligence pilot records b) innovation initiatives standard data collection and initiative reporting
A22: Output 4.2 | B22: # of members involved in innovation initiatives (approaches, tools and services) across hubs | C22: n/a | D22: n/a | E22: n/a | F22: baseline to be collected | G22: dependent on baseline | H22: dependent on baseline | I22: standard innovation initiative data collection
A23: Output 4.3 | B23: # research pieces related to innovation and systems change | C23: 0 | D23: 5 | E23: 0 | F23: 1 | G23: 2 | H23: 2 | I23: evaluation / research outputs
A24: Output 4.4 | B24: £ - Amount of programme funding granted to LNNGOs for innovation projects and initiatives | C24: n/a | D24: n/a | E24: n/a | F24: baseline to be collected | G24: dependent on baseline | H24: dependent on baseline | I24: innovation finance records
A25: Output 4.5 | B25: Number of risk sharing dialogues between local and international actors | C25: n/a | D25: n/a | E25: n/a | F25: baseline to be collected from April 2025 | G25: baseline to be collected from April 2025 | H25: baseline to be collected from April 2025 | I25: Hub documentation, data from hub progress measurement
A26: Output 4.6 | B26: Information about specific capacity / risk / cost sharing and overhead to local partners | C26: n/a | D26: n/a | E26: n/a | F26: n/a | G26: n/a | H26: n/a | I26: Qualitative indicator: narrative based on hub measurement framework indicators which are in development

Sheet: Annual_Plan
A1: Description_of_expected_results | B1: Indicators | C1: Baseline_2024 | D1: Target_End | E1: Means_of_Verification | F1: Target_2025
A2: Outcome 1 | B2: of:=[$Logframe.B2] -> Expand network of humanitarian hubs | C2: of:=[$Logframe.C2] -> n/a  | D2: of:=[$Logframe.D2] -> n/a  | E2: of:=[$Logframe.I2] -> Qualitative indicator: narrative based on the indicators below.  | F2: of:=[$Logframe.F2] -> n/a 
A3: Output 1.1 | B3: of:=[$Logframe.B3] -> Hubs: # mature (% of total) | C3: of:=[$Logframe.C3] -> 0 | D3: of:=[$Logframe.D3] -> 5 (33%) | E3: of:=[$Logframe.I3] -> Hub documentation, data from hub progress measurement  | F3: of:=[$Logframe.F3] -> 1 (7%)
A4: Output 1.2 | B4: of:=[$Logframe.B4] -> Total number of hubs  | C4: of:=[$Logframe.C4] -> 10 | D4: of:=[$Logframe.D4] -> 15 | E4: of:=[$Logframe.I4] -> Hub documentation (e..g, hub agreements) | F4: of:=[$Logframe.F4] -> 2
A5: Output 1.3 | B5: of:=[$Logframe.B5] -> Hubs: # in incubation | C5: of:=[$Logframe.C5] -> 10 | D5: of:=[$Logframe.D5] -> 10 | E5: of:=[$Logframe.I5] -> Hub documentation, data from hub progress measurement  | F5: of:=[$Logframe.F5] -> 9
A6: Outcome 2 | B6: of:=[$Logframe.B6] -> Scope, test and operationalise locally-led/designed tools and approaches to the anticipation of the humanitarian impact of conflict and man-made risks. | C6: of:=[$Logframe.C6] -> n/a  | D6: of:=[$Logframe.D6] -> n/a  | E6: of:=[$Logframe.I6] -> Qualitative indicator: narrative based on the indicators below.  | F6: of:=[$Logframe.F6] -> n/a 
A7: Output 2.1 | B7: of:=[$Logframe.B7] -> # of SF projects implemented as a result of forecasted hazard identified by tools
 | C7: of:=[$Logframe.C7] -> n/a  | D7: of:=[$Logframe.D7] -> TBC | E7: of:=[$Logframe.I7] -> Start Fund project reports, anticipation tool reports | F7: of:=[$Logframe.F7] -> TBC
A8: Output 2.2 | B8: of:=[$Logframe.B9] -> # of country/context specific tools that are developed  | C8: of:=[$Logframe.C9] -> 0 | D8: of:=[$Logframe.D9] -> 4 tools adapted to at least 2 contexts | E8: of:=[$Logframe.I9] -> anticipation tool reports | F8: of:=[$Logframe.F9] -> 1 tool adapted to at least 1 context
A9: Output 2.3 | B9: of:=[$Logframe.B10] -> # of trainings/workshops for members to scale up anticipatory action interventions to prevent the humanitarian effect of man-made crises | C9: of:=[$Logframe.C10] -> n/a | D9: of:=[$Logframe.D10] -> 4 | E9: of:=[$Logframe.I10] -> internal documentation, training schedule | F9: of:=[$Logframe.F10] -> 1 design workshop
A10: Outcome 3 | B10: of:=[$Logframe.B11] -> (a) Upscale the involvement of national and local organisations in decision making and (b) Improve their access to international funding,and (c) share best practices related to the above with other pooled funds | C10: of:=[$Logframe.C11] -> n/a | D10: of:=[$Logframe.D11] -> n/a | E10: of:=[$Logframe.I11] -> Qualitative indicator: narrative based on the indicators below.  | F10: of:=[$Logframe.F11] -> n/a
A11: Output 3.1 | B11: of:=[$Logframe.B12] ->  % (#) of member LNNGOs which submit proposals in countries where an alert has been raised (this should only include LNNGOs which have been onboarded) | C11: of:=[$Logframe.C12] -> 0.75 | D11: of:=[$Logframe.D12] -> 0.78 | E11: of:=[$Logframe.I12] -> Standard Start Fund alert data collection | F11: of:=[$Logframe.F12] -> 0.75
A12: Output 3.2 | B12: of:=[$Logframe.B16] -> # of trainings provided to LLNGOs on implementing key humanitarian principles and enhanced local leadership and governance | C12: of:=[$Logframe.C16] -> 1 | D12: of:=[$Logframe.D16] -> 3 | E12: of:=[$Logframe.I16] -> training reports | F12: of:=[$Logframe.F16] -> 1
A13: Output 3.3 | B13: of:=[$Logframe.B17] -> # of mentors across various countries trained to provide ongoing support and guidance to member organizations | C13: of:=[$Logframe.C17] -> 1 | D13: of:=[$Logframe.D17] -> 3 | E13: of:=[$Logframe.I17] -> recorded mentor agreements | F13: of:=[$Logframe.F17] -> 0
A14: Output 3.4 | B14: of:=[$Logframe.B18] -> # of evaluations/research pieces related to the impact of strengthening local leadership and localisation practices | C14: of:=[$Logframe.C18] -> 0 | D14: of:=[$Logframe.D18] -> 3 | E14: of:=[$Logframe.I18] -> evaluation / research outputs | F14: of:=[$Logframe.F18] -> 1
A15: Output 3.5 | B15: of:=[$Logframe.B19] -> # of Learning Grants awarded to LLNGOs | C15: of:=[$Logframe.C19] -> n/a  | D15: of:=[$Logframe.D19] -> 11 | E15: of:=[$Logframe.I19] -> Standard Start Fund learning grant data collection | F15: of:=[$Logframe.F19] -> 2
A16: Outcome 4 | B16: of:=[$Logframe.B20] -> (a) Support BAU (business as usual) due diligence processes for local and national members, and b) support innovative approaches to due diligence, risk, and compliance through learning iterations and testing of initiatives to support local and national members (b) support innovation initiatives for hubs, and support local humanitarians to take the lead in identifying local solutions to local problems. | C16: of:=[$Logframe.C20] -> n/a | D16: of:=[$Logframe.D20] -> n/a | E16: of:=[$Logframe.I20] -> Qualitative indicator: narrative based on the indicators below.  | F16: of:=[$Logframe.F20] -> n/a
A17: Output 4.1 | B17: of:=[$Logframe.B21] -> a) # member local and national organisations that have progressed through due diligence
ai) # of organisations that participated in DD innovation pilot and feel better supported by our compliance systems 
b) # community-led innovation initiatives co-designed and run with hubs | C17: of:=[$Logframe.C21] -> N/A | D17: of:=[$Logframe.D21] -> b)9 | E17: of:=[$Logframe.I21] -> a) due diligence records
ai) due diligence pilot records
b) innovation initiatives standard data collection and initiative reporting | F17: of:=[$Logframe.F21] -> a)23
ai) dependent on baseline
b) 2
A18: Output 4.2 | B18: of:=[$Logframe.B22] -> # of members involved in innovation initiatives (approaches, tools and services) across hubs | C18: of:=[$Logframe.C22] -> n/a | D18: of:=[$Logframe.D22] -> n/a  | E18: of:=[$Logframe.I22] -> standard innovation initiative data collection | F18: of:=[$Logframe.F22] -> baseline to be collected
A19: Output 4.3 | B19: of:=[$Logframe.B23] -> # research pieces related to innovation and systems change  | C19: of:=[$Logframe.C23] -> 0 | D19: of:=[$Logframe.D23] -> 5 | E19: of:=[$Logframe.I23] -> evaluation / research outputs | F19: of:=[$Logframe.F23] -> 1
A20: Output 4.4 | B20: of:=[$Logframe.B24] -> £ - Amount of programme funding granted to LNNGOs for innovation projects and initiatives  | C20: of:=[$Logframe.C24] -> n/a | D20: of:=[$Logframe.D24] -> n/a  | E20: of:=[$Logframe.I24] -> innovation finance records | F20: of:=[$Logframe.F24] -> baseline to be collected
A21: Output 4.5 | B21: of:=[$Logframe.B25] -> Number of risk sharing dialogues between local and international actors | C21: of:=[$Logframe.C25] -> n/a | D21: of:=[$Logframe.D25] -> n/a  | E21: of:=[$Logframe.I25] -> Hub documentation, data from hub progress measurement  | F21: of:=[$Logframe.F25] -> baseline to be collected from April 2025
A22: Output 4.6 | B22: of:=[$Logframe.B26] -> Information about specific capacity / risk / cost sharing and overhead to local partners | C22: of:=[$Logframe.C26] -> n/a  | D22: of:=[$Logframe.D26] -> n/a  | E22: of:=[$Logframe.I26] -> Qualitative indicator: narrative based on hub measurement framework indicators which are in development | F22: of:=[$Logframe.F26] -> n/a

Sheet: Annual_Progress
A1: Description_of_expected_results | B1: Indicators | C1: Baseline_year | D1: Target_End | E1: Means_of_Verification | F1: Target_2024 | G1: Results_2024 | H1: Variance | I1: Explanation_of_variance
A2: Outcome 1 | B2: of:=[$Annual_Plan.B2] -> Expand network of humanitarian hubs | C2: of:=[$Annual_Plan.C2] -> n/a  | D2: of:=[$Logframe.D2] -> n/a  | E2: of:=[$Annual_Plan.E2] -> Qualitative indicator: narrative based on the indicators below.  | F2: of:=[$Logframe.E2] -> n/a 
A3: Output 1.1 | B3: of:=[$Annual_Plan.B3] -> Hubs: # mature (% of total) | C3: of:=[$Annual_Plan.C3] -> 0 | D3: of:=[$Logframe.D3] -> 5 (33%) | E3: of:=[$Annual_Plan.E3] -> Hub documentation, data from hub progress measurement  | F3: of:=[$Logframe.E3] -> 0
A4: Output 1.2 | B4: of:=[$Annual_Plan.B4] -> Total number of hubs  | C4: of:=[$Annual_Plan.C4] -> 10 | D4: of:=[$Annual_Plan.D4] -> 15 | E4: of:=[$Annual_Plan.E4] -> Hub documentation (e..g, hub agreements) | F4: of:=[$Logframe.E4] -> 10
A5: Output 1.3 | B5: of:=[$Annual_Plan.B5] -> Hubs: # in incubation | C5: of:=[$Annual_Plan.C5] -> 10 | D5: of:=[$Annual_Plan.D5] -> 10 | E5: of:=[$Annual_Plan.E5] -> Hub documentation, data from hub progress measurement  | F5: of:=[$Logframe.E5] -> 10
A6: Outcome 2 | B6: of:=[$Annual_Plan.B5] -> Hubs: # in incubation | C6: of:=[$Annual_Plan.C5] -> 10 | D6: of:=[$Logframe.D5] -> 10 | E6: of:=[$Annual_Plan.E5] -> Hub documentation, data from hub progress measurement  | F6: of:=[$Logframe.E6] -> n/a 
A7: Output 2.1 | B7: of:=[$Annual_Plan.B6] -> Scope, test and operationalise locally-led/designed tools and approaches to the anticipation of the humanitarian impact of conflict and man-made risks. | C7: of:=[$Annual_Plan.C6] -> n/a  | D7: of:=[$Logframe.D6] -> n/a  | E7: of:=[$Annual_Plan.E6] -> Qualitative indicator: narrative based on the indicators below.  | F7: of:=[$Logframe.E7] -> TBC
A8: Output 2.2 | B8: of:=[$Annual_Plan.B7] -> # of SF projects implemented as a result of forecasted hazard identified by tools
 | C8: of:=[$Annual_Plan.C7] -> n/a  | D8: of:=[$Logframe.D7] -> TBC | E8: of:=[$Annual_Plan.E7] -> Start Fund project reports, anticipation tool reports | F8: of:=[$Logframe.E8] -> TBC
A9: Output 2.3 | B9: of:=[$Annual_Plan.B8] -> # of country/context specific tools that are developed  | C9: of:=[$Annual_Plan.C8] -> 0 | D9: of:=[$Logframe.D9] -> 4 tools adapted to at least 2 contexts | E9: of:=[$Annual_Plan.E8] -> anticipation tool reports | F9: of:=[$Logframe.E9] -> 0
A10: Outcome 3 | B10: of:=[$Annual_Plan.B9] -> # of trainings/workshops for members to scale up anticipatory action interventions to prevent the humanitarian effect of man-made crises | C10: of:=[$Annual_Plan.C9] -> n/a | D10: of:=[$Logframe.D10] -> 4 | E10: of:=[$Annual_Plan.E9] -> internal documentation, training schedule | F10: of:=[$Logframe.E10] -> n/a
A11: Output 3.1 | B11: of:=[$Annual_Plan.B10] -> (a) Upscale the involvement of national and local organisations in decision making and (b) Improve their access to international funding,and (c) share best practices related to the above with other pooled funds | C11: of:=[$Annual_Plan.C10] -> n/a | D11: of:=[$Logframe.D11] -> n/a | E11: of:=[$Annual_Plan.E10] -> Qualitative indicator: narrative based on the indicators below.  | F11: of:=[$Logframe.E11] -> n/a
A12: Output 3.2 | B12: of:=[$Annual_Plan.B11] ->  % (#) of member LNNGOs which submit proposals in countries where an alert has been raised (this should only include LNNGOs which have been onboarded) | C12: of:=[$Annual_Plan.C11] -> 0.75 | D12: of:=[$Logframe.D12] -> 0.78 | E12: of:=[$Annual_Plan.E11] -> Standard Start Fund alert data collection | F12: of:=[$Logframe.E12] -> 0.75
A13: Output 3.3 | B13: of:=[$Annual_Plan.B12] -> # of trainings provided to LLNGOs on implementing key humanitarian principles and enhanced local leadership and governance | C13: of:=[$Annual_Plan.C12] -> 1 | D13: of:=[$Logframe.D16] -> 3 | E13: of:=[$Annual_Plan.E12] -> training reports | F13: of:=[$Logframe.E13] -> i) 11%
ii) 52%
iii) 48%
A14: Output 3.4 | B14: of:=[$Annual_Plan.B13] -> # of mentors across various countries trained to provide ongoing support and guidance to member organizations | C14: of:=[$Annual_Plan.C13] -> 1 | D14: of:=[$Logframe.D17] -> 3 | E14: of:=[$Annual_Plan.E13] -> recorded mentor agreements | F14: of:=[$Logframe.E14] -> i) 46%
ii) 71%
A15: Output 3.5 | B15: of:=[$Annual_Plan.B14] -> # of evaluations/research pieces related to the impact of strengthening local leadership and localisation practices | C15: of:=[$Annual_Plan.C14] -> 0 | D15: of:=[$Logframe.D18] -> 3 | E15: of:=[$Annual_Plan.E14] -> evaluation / research outputs | F15: of:=[$Logframe.E15] -> 1
A16: Outcome 4 | B16: of:=[$Annual_Plan.B15] -> # of Learning Grants awarded to LLNGOs | C16: of:=[$Annual_Plan.C15] -> n/a  | D16: of:=[$Logframe.D19] -> 11 | E16: of:=[$Annual_Plan.E15] -> Standard Start Fund learning grant data collection | F16: of:=[$Logframe.E16] -> 0
A17: Output 4.1 | B17: of:=[$Annual_Plan.B16] -> (a) Support BAU (business as usual) due diligence processes for local and national members, and b) support innovative approaches to due diligence, risk, and compliance through learning iterations and testing of initiatives to support local and national members (b) support innovation initiatives for hubs, and support local humanitarians to take the lead in identifying local solutions to local problems. | C17: of:=[$Annual_Plan.C16] -> n/a | D17: of:=[$Logframe.D20] -> n/a | E17: of:=[$Annual_Plan.E16] -> Qualitative indicator: narrative based on the indicators below.  | F17: of:=[$Logframe.E17] -> 0
A18: Output 4.2 | B18: of:=[$Annual_Plan.B17] -> a) # member local and national organisations that have progressed through due diligence
ai) # of organisations that participated in DD innovation pilot and feel better supported by our compliance systems 
b) # community-led innovation initiatives co-designed and run with hubs | C18: of:=[$Annual_Plan.C17] -> N/A | D18: of:=[$Logframe.D21] -> b)9 | E18: of:=[$Annual_Plan.E17] -> a) due diligence records
ai) due diligence pilot records
b) innovation initiatives standard data collection and initiative reporting | F18: of:=[$Logframe.E18] -> 0
A19: Output 4.3 | B19: of:=[$Annual_Plan.B18] -> # of members involved in innovation initiatives (approaches, tools and services) across hubs | C19: of:=[$Annual_Plan.C18] -> n/a | D19: of:=[$Logframe.D22] -> n/a  | E19: of:=[$Annual_Plan.E18] -> standard innovation initiative data collection | F19: of:=[$Logframe.E19] -> 1
A20: Output 4.4 | B20: of:=[$Annual_Plan.B19] -> # research pieces related to innovation and systems change  | C20: of:=[$Annual_Plan.C19] -> 0 | D20: of:=[$Logframe.D23] -> 5 | E20: of:=[$Annual_Plan.E19] -> evaluation / research outputs | F20: of:=[$Logframe.E20] -> n/a
A21: Output 4.5 | B21: of:=[$Annual_Plan.B20] -> £ - Amount of programme funding granted to LNNGOs for innovation projects and initiatives  | C21: of:=[$Annual_Plan.C20] -> n/a | D21: of:=[$Annual_Plan.D20] -> n/a  | E21: of:=[$Annual_Plan.E20] -> innovation finance records | F21: of:=[$Logframe.E21] -> a) n/a
ai) baseline to be collected in Jan '25
b) 1
A22: Output 4.6 | B22: of:=[$Annual_Plan.B21] -> Number of risk sharing dialogues between local and international actors | C22: of:=[$Annual_Plan.C21] -> n/a | D22: of:=[$Annual_Plan.D21] -> n/a  | E22: of:=[$Annual_Plan.E21] -> Hub documentation, data from hub progress measurement  | F22: of:=[$Logframe.E22] -> n/a